263,"2005-05-26 15:47:40",1160,449,"2005-05-30 10:07:40","2006-02-15 21:30:53","DROP WATERFRONT","A Fanciful Documentary of a Husband And a Explorer who must Reach a Madman in Ancient China",2006,English,NULL,6,R,"28 MySQL Boulevard",Woodridge,21872,474047727727,"OSCAR AQUINO",OSCAR.AQUINO@sakilacustomer.org,"Jon Stephens",Jon.Stephens@sakilastaff.com,2,12114,4.99,"2005-05-26 15:47:40"
264,"2005-05-26 16:00:49",2069,251,"2005-05-27 10:12:49","2006-02-15 21:30:53","IDENTITY LOVER","A Boring Tale of a Composer And a Mad Cow who must Defeat a Car in The Outback",2006,English,NULL,4,PG-13,"28 MySQL Boulevard",Woodridge,36481,567359279425,"VICKIE BREWER",VICKIE.BREWER@sakilacustomer.org,"Jon Stephens",Jon.Stephens@sakilastaff.com,1,6757,2.99,"2005-05-26 16:00:49"
265,"2005-05-26 16:07:38",2276,303,"2005-06-01 14:20:38","2006-02-15 21:30:53","JUNGLE CLOSER","A Boring Character Study of a Boy And a Woman who must Battle a Astronaut in Australia",2006,English,NULL,6,NC-17,"47 MySakila Drive",Lethbridge,57587,407218522294,"WILLIAM SATTERFIELD",WILLIAM.SATTERFIELD@sakilacustomer.org,"Mike Hillyer",Mike.Hillyer@sakilastaff.com,1,8217,0.99,"2005-05-26 16:07:38"
266,"2005-05-26 16:08:05",3303,263,"2005-05-27 10:55:05","2006-02-15 21:30:53","RESURRECTION SILVERADO","A Epic Yarn of a Robot And a Explorer who must Challenge a Girl in A MySQL Convention",2006,English,NULL,6,PG,"28 MySQL Boulevard",Woodridge,51990,322888976727,"HILDA HOPKINS",HILDA.HOPKINS@sakilacustomer.org,"Jon Stephens",Jon.Stephens@sakilastaff.com,1,7099,0.99,"2005-05-26 16:08:05"
267,"2005-05-26 16:16:21",1206,417,"2005-05-30 16:53:21","2006-02-15 21:30:53","EARLY HOME","A Amazing Panorama of a Mad Scientist And a Husband who must Meet a Woman in The Outback",2006,English,NULL,6,NC-17,"28 MySQL Boulevard",Woodridge,72410,214976066017,"TRAVIS ESTEP",TRAVIS.ESTEP@sakilacustomer.org,"Jon Stephens",Jon.Stephens@sakilastaff.com,1,11270,4.99,"2005-05-26 16:16:21"
268,"2005-05-26 16:19:08",1714,75,"2005-05-27 14:35:08","2006-02-15 21:30:53","GRAFFITI LOVE","A Unbelieveable Epistle of a Sumo Wrestler And a Hunter who must Build a Composer in Berlin",2006,English,NULL,3,PG,"47 MySakila Drive",Lethbridge,72394,251164340471,"TAMMY SANDERS",TAMMY.SANDERS@sakilacustomer.org,"Mike Hillyer",Mike.Hillyer@sakilastaff.com,2,2022,0.99,"2005-05-26 16:19:08"
269,"2005-05-26 16:19:46",3501,322,"2005-05-27 15:59:46","2006-02-15 21:30:53","SCALAWAG DUCK","A Fateful Reflection of a Car And a Teacher who must Confront a Waitress in A Monastery",2006,English,NULL,6,NC-17,"47 MySakila Drive",Lethbridge,85799,972574862516,"JASON MORRISSEY",JASON.MORRISSEY@sakilacustomer.org,"Mike Hillyer",Mike.Hillyer@sakilastaff.com,1,8696,4.99,"2005-05-26 16:19:46"
270,"2005-05-26 16:20:56",207,200,"2005-06-03 12:40:56","2006-02-15 21:30:53","AUTUMN CROW","A Beautiful Tale of a Dentist And a Mad Cow who must Battle a Moose in The Sahara Desert",2006,English,NULL,3,G,"28 MySQL Boulevard",Woodridge,8073,764477681869,"JEANNE LAWSON",JEANNE.LAWSON@sakilacustomer.org,"Jon Stephens",Jon.Stephens@sakilastaff.com,2,5418,9.99,"2005-05-26 16:20:56"
271,"2005-05-26 16:22:01",2388,92,"2005-06-03 17:30:01","2006-02-15 21:30:53","LIES TREATMENT","A Fast-Paced Character Study of a Dentist And a Moose who must Defeat a Composer in The First Manned Space Station",2006,English,NULL,7,NC-17,"47 MySakila Drive",Lethbridge,17119,132986892228,"TINA SIMMONS",TINA.SIMMONS@sakilacustomer.org,"Mike Hillyer",Mike.Hillyer@sakilastaff.com,1,2504,5.99,"2005-05-26 16:22:01"
272,"2005-05-26 16:27:11",971,71,"2005-06-03 13:10:11","2006-02-15 21:30:53","DAY UNFAITHFUL","A Stunning Documentary of a Composer And a Mad Scientist who must Find a Technical Writer in A U-Boat",2006,English,NULL,3,G,"28 MySQL Boulevard",Woodridge,50805,565018274456,"KATHY JAMES",KATHY.JAMES@sakilacustomer.org,"Jon Stephens",Jon.Stephens@sakilastaff.com,1,1911,9.99,"2005-05-26 16:27:11"
273,"2005-05-26 16:29:36",1590,193,"2005-05-29 18:49:36","2006-02-15 21:30:53","GANGS PRIDE","A Taut Character Study of a Woman And a A Shark who must Confront a Frisbee in Berlin",2006,English,NULL,4,PG-13,"47 MySakila Drive",Lethbridge,10428,940830176580,"KATIE ELLIOTT",KATIE.ELLIOTT@sakilacustomer.org,"Mike Hillyer",Mike.Hillyer@sakilastaff.com,2,5219,2.99,"2005-05-26 16:29:36"
274,"2005-05-26 16:48:51",656,311,"2005-06-03 18:17:51","2006-02-15 21:30:53","CHICKEN HELLFIGHTERS","A Emotional Drama of a Dog And a Explorer who must Outrace a Technical Writer in Australia",2006,English,NULL,3,PG,"47 MySakila Drive",Lethbridge,94878,688485191923,"PAUL TROUT",PAUL.TROUT@sakilacustomer.org,"Mike Hillyer",Mike.Hillyer@sakilastaff.com,2,8432,5.99,"2005-05-26 16:48:51"
275,"2005-05-26 17:09:53",1718,133,"2005-06-04 22:35:53","2006-02-15 21:30:53","GRAFFITI LOVE","A Unbelieveable Epistle of a Sumo Wrestler And a Hunter who must Build a Composer in Berlin",2006,English,NULL,3,PG,"28 MySQL Boulevard",Woodridge,83401,321944036800,"PAULINE HENRY",PAULINE.HENRY@sakilacustomer.org,"Jon Stephens",Jon.Stephens@sakilastaff.com,1,3586,6.99,"2005-05-26 17:09:53"
276,"2005-05-26 17:16:07",1221,58,"2005-06-03 12:59:07","2006-02-15 21:30:53","EASY GLADIATOR","A Fateful Story of a Monkey And a Girl who must Overcome a Pastry Chef in Ancient India",2006,English,NULL,5,G,"47 MySakila Drive",Lethbridge,69226,212869228936,"JEAN BELL",JEAN.BELL@sakilacustomer.org,"Mike Hillyer",Mike.Hillyer@sakilastaff.com,2,1594,7.99,"2005-05-26 17:16:07"
277,"2005-05-26 17:32:11",1409,45,"2005-05-28 22:54:11","2006-02-15 21:30:53","FERRIS MOTHER","A Touching Display of a Frisbee And a Frisbee who must Kill a Girl in The Gulf of Mexico",2006,English,NULL,3,PG,"28 MySQL Boulevard",Woodridge,37359,675292816413,"JANET PHILLIPS",JANET.PHILLIPS@sakilacustomer.org,"Jon Stephens",Jon.Stephens@sakilastaff.com,2,1229,2.99,"2005-05-26 17:32:11"
278,"2005-05-26 17:40:58",182,214,"2005-06-02 16:43:58","2006-02-15 21:30:53","ARMY FLINTSTONES","A Boring Saga of a Database Administrator And a Womanizer who must Battle a Waitress in Nigeria",2006,English,NULL,4,R,"28 MySQL Boulevard",Woodridge,2299,785881412500,"KRISTIN JOHNSTON",KRISTIN.JOHNSTON@sakilacustomer.org,"Jon Stephens",Jon.Stephens@sakilastaff.com,1,5802,3.99,"2005-05-26 17:40:58"
279,"2005-05-26 18:02:50",661,384,"2005-06-03 18:48:50","2006-02-15 21:30:53","CHILL LUCK","A Lacklusture Epistle of a Boat And a Technical Writer who must Fight a A Shark in The Canadian Rockies",2006,English,NULL,6,PG,"47 MySakila Drive",Lethbridge,95509,550306965159,"ERNEST STEPP",ERNEST.STEPP@sakilacustomer.org,"Mike Hillyer",Mike.Hillyer@sakilastaff.com,2,10394,2.99,"2005-05-26 18:02:50"
280,"2005-05-26 18:36:58",1896,167,"2005-05-27 23:42:58","2006-02-15 21:30:53","HEDWIG ALTER","A Action-Packed Yarn of a Womanizer And a Lumberjack who must Chase a Sumo Wrestler in A Monastery",2006,English,NULL,7,NC-17,"47 MySakila Drive",Lethbridge,62686,182363341674,"SALLY PIERCE",SALLY.PIERCE@sakilacustomer.org,"Mike Hillyer",Mike.Hillyer@sakilastaff.com,1,4516,2.99,"2005-05-26 18:36:58"
281,"2005-05-26 18:49:35",1208,582,"2005-05-27 18:11:35","2006-02-15 21:30:53","EARRING INSTINCT","A Stunning Character Study of a Dentist And a Mad Cow who must Find a Teacher in Nigeria",2006,English,NULL,3,R,"47 MySakila Drive",Lethbridge,62703,995527378381,"ANDY VANHORN",ANDY.VANHORN@sakilacustomer.org,"Mike Hillyer",Mike.Hillyer@sakilastaff.com,1,15588,0.99,"2005-05-26 18:49:35"
282,"2005-05-26 18:56:26",4486,282,"2005-06-01 16:32:26","2006-02-15 21:30:53","WIZARD COLDBLOODED","A Lacklusture Display of a Robot And a Girl who must Defeat a Sumo Wrestler in A MySQL Convention",2006,English,NULL,4,PG,"47 MySakila Drive",Lethbridge,8160,62781725285,"JENNY CASTRO",JENNY.CASTRO@sakilacustomer.org,"Mike Hillyer",Mike.Hillyer@sakilastaff.com,2,7626,6.99,"2005-05-26 18:56:26"
283,"2005-05-26 19:05:05",3530,242,"2005-05-31 19:19:05","2006-02-15 21:30:53","SEA VIRGIN","A Fast-Paced Documentary of a Technical Writer And a Pastry Chef who must Escape a Moose in A U-Boat",2006,English,NULL,4,PG,"28 MySQL Boulevard",Woodridge,28349,890283544295,"GLENDA FRAZIER",GLENDA.FRAZIER@sakilacustomer.org,"Jon Stephens",Jon.Stephens@sakilastaff.com,2,6535,3.99,"2005-05-26 19:05:05"
284,"2005-05-26 19:21:44",350,359,"2005-06-04 14:18:44","2006-02-15 21:30:53","BIRDS PERDITION","A Boring Story of a Womanizer And a Pioneer who must Face a Dog in California",2006,English,NULL,5,G,"28 MySQL Boulevard",Woodridge,91299,296394569728,"WILLIE MARKHAM",WILLIE.MARKHAM@sakilacustomer.org,"Jon Stephens",Jon.Stephens@sakilastaff.com,1,9684,8.99,"2005-05-26 19:21:44"
285,"2005-05-26 19:41:40",2486,162,"2005-05-31 16:58:40","2006-02-15 21:30:53","MADNESS ATTACKS","A Fanciful Tale of a Squirrel And a Boat who must Defeat a Crocodile in The Gulf of Mexico",2006,English,NULL,4,PG-13,"47 MySakila Drive",Lethbridge,22853,168476538960,"LAUREN HUDSON",LAUREN.HUDSON@sakilacustomer.org,"Mike Hillyer",Mike.Hillyer@sakilastaff.com,1,4402,1.99,"2005-05-26 19:41:40"
286,"2005-05-26 19:44:51",314,371,"2005-06-04 18:00:51","2006-02-15 21:30:53","BIKINI BORROWERS","A Astounding Drama of a Astronaut And a Cat who must Discover a Woman in The First Manned Space Station",2006,English,NULL,7,NC-17,"28 MySQL Boulevard",Woodridge,57810,333390595558,"BILLY POULIN",BILLY.POULIN@sakilacustomer.org,"Jon Stephens",Jon.Stephens@sakilastaff.com,2,10020,6.99,"2005-05-26 19:44:51"
287,"2005-05-26 19:44:54",3631,17,"2005-06-02 01:10:54","2006-02-15 21:30:53","SHREK LICENSE","A Fateful Yarn of a Secret Agent And a Feminist who must Find a Feminist in A Jet Boat",2006,English,NULL,7,PG-13,"28 MySQL Boulevard",Woodridge,81766,407752414682,"DONNA THOMPSON",DONNA.THOMPSON@sakilacustomer.org,"Jon Stephens",Jon.Stephens@sakilastaff.com,2,447,2.99,"2005-05-26 19:44:54"
288,"2005-05-26 19:47:49",3546,82,"2005-06-03 20:53:49","2006-02-15 21:30:53","SEATTLE EXPECATIONS","A Insightful Reflection of a Crocodile And a Sumo Wrestler who must Meet a Technical Writer in The Sahara Desert",2006,English,NULL,4,PG-13,"28 MySQL Boulevard",Woodridge,9495,821972242086,"KATHRYN COLEMAN",KATHRYN.COLEMAN@sakilacustomer.org,"Jon Stephens",Jon.Stephens@sakilastaff.com,2,2219,8.99,"2005-05-26 19:47:49"
289,"2005-05-26 20:01:09",2449,81,"2005-05-28 15:09:09","2006-02-15 21:30:53","LOUISIANA HARRY","A Lacklusture Drama of a Girl And a Technical Writer who must Redeem a Monkey in A Shark Tank",2006,English,NULL,5,PG-13,"28 MySQL Boulevard",Woodridge,37307,223664661973,"ANDREA HENDERSON",ANDREA.HENDERSON@sakilacustomer.org,"Jon Stephens",Jon.Stephens@sakilastaff.com,1,2196,0.99,"2005-05-26 20:01:09"
290,"2005-05-26 20:08:33",2776,429,"2005-05-30 00:32:33","2006-02-15 21:30:53","MUSCLE BRIGHT","A Stunning Panorama of a Sumo Wrestler And a Husband who must Redeem a Madman in Ancient India",2006,English,NULL,7,G,"28 MySQL Boulevard",Woodridge,87212,572068624538,"FREDERICK ISBELL",FREDERICK.ISBELL@sakilacustomer.org,"Jon Stephens",Jon.Stephens@sakilastaff.com,2,11578,2.99,"2005-05-26 20:08:33"
291,"2005-05-26 20:20:47",485,577,"2005-06-03 02:06:47","2006-02-15 21:30:53","BUTTERFLY CHOCOLAT","A Fateful Story of a Girl And a Composer who must Conquer a Husband in A Shark Tank",2006,English,NULL,3,G,"47 MySakila Drive",Lethbridge,98883,29341849811,"CLIFTON MALCOLM",CLIFTON.MALCOLM@sakilacustomer.org,"Mike Hillyer",Mike.Hillyer@sakilastaff.com,2,15457,5.99,"2005-05-26 20:20:47"
292,"2005-05-26 20:22:12",4264,515,"2005-06-05 00:58:12","2006-02-15 21:30:53","UPRISING UPTOWN","A Fanciful Reflection of a Boy And a Butler who must Pursue a Woman in Berlin",2006,English,NULL,6,NC-17,"47 MySakila Drive",Lethbridge,92568,602101369463,"ANDRE RAPP",ANDRE.RAPP@sakilacustomer.org,"Mike Hillyer",Mike.Hillyer@sakilastaff.com,2,13861,6.99,"2005-05-26 20:22:12"
293,"2005-05-26 20:27:02",1828,158,"2005-06-03 16:45:02","2006-02-15 21:30:53","HANKY OCTOBER","A Boring Epistle of a Database Administrator And a Explorer who must Pursue a Madman in Soviet Georgia",2006,English,NULL,5,NC-17,"47 MySakila Drive",Lethbridge,66639,170117068815,"VERONICA STONE",VERONICA.STONE@sakilacustomer.org,"Mike Hillyer",Mike.Hillyer@sakilastaff.com,1,4293,5.99,"2005-05-26 20:27:02"
294,"2005-05-26 20:29:57",2751,369,"2005-05-28 17:20:57","2006-02-15 21:30:53","MOVIE SHAKESPEARE","A Insightful Display of a Database Administrator And a Student who must Build a Hunter in Berlin",2006,English,NULL,6,PG,"47 MySakila Drive",Lethbridge,91330,561729882725,"FRED WHEAT",FRED.WHEAT@sakilacustomer.org,"Mike Hillyer",Mike.Hillyer@sakilastaff.com,1,9976,4.99,"2005-05-26 20:29:57"
295,"2005-05-26 20:33:20",4030,65,"2005-05-27 18:23:20","2006-02-15 21:30:53","TEEN APOLLO","A Awe-Inspiring Drama of a Dog And a Man who must Escape a Robot in A Shark Tank",2006,English,NULL,3,G,"28 MySQL Boulevard",Woodridge,71110,409983924481,"ROSE HOWARD",ROSE.HOWARD@sakilacustomer.org,"Jon Stephens",Jon.Stephens@sakilastaff.com,1,1767,4.99,"2005-05-26 20:33:20"
296,"2005-05-26 20:35:19",3878,468,"2005-06-04 02:31:19","2006-02-15 21:30:53","STONE FIRE","A Intrepid Drama of a Astronaut And a Crocodile who must Find a Boat in Soviet Georgia",2006,English,NULL,3,G,"47 MySakila Drive",Lethbridge,33599,195337700615,"TIM CARY",TIM.CARY@sakilacustomer.org,"Mike Hillyer",Mike.Hillyer@sakilastaff.com,2,12613,6.99,"2005-05-26 20:35:19"
297,"2005-05-26 20:48:48",1594,48,"2005-05-27 19:52:48","2006-02-15 21:30:53","GANGS PRIDE","A Taut Character Study of a Woman And a A Shark who must Confront a Frisbee in Berlin",2006,English,NULL,4,PG-13,"28 MySQL Boulevard",Woodridge,69367,705800322606,"ANN EVANS",ANN.EVANS@sakilacustomer.org,"Jon Stephens",Jon.Stephens@sakilastaff.com,1,1313,2.99,"2005-05-26 20:48:48"
298,"2005-05-26 20:52:26",1083,460,"2005-05-29 22:08:26","2006-02-15 21:30:53","DONNIE ALLEY","A Awe-Inspiring Tale of a Butler And a Frisbee who must Vanquish a Teacher in Ancient Japan",2006,English,NULL,4,NC-17,"47 MySakila Drive",Lethbridge,70664,366776723320,"LEON BOSTIC",LEON.BOSTIC@sakilacustomer.org,"Mike Hillyer",Mike.Hillyer@sakilastaff.com,2,12416,0.99,"2005-05-26 20:52:26"
299,"2005-05-26 20:55:36",4376,448,"2005-05-28 00:25:36","2006-02-15 21:30:53","WANDA CHAMBER","A Insightful Drama of a A Shark And a Pioneer who must Find a Womanizer in The Outback",2006,English,NULL,7,PG-13,"47 MySakila Drive",Lethbridge,99552,72524459905,"MIGUEL BETANCOURT",MIGUEL.BETANCOURT@sakilacustomer.org,"Mike Hillyer",Mike.Hillyer@sakilastaff.com,1,12085,4.99,"2005-05-26 20:55:36"
300,"2005-05-26 20:57:00",249,47,"2005-06-05 01:34:00","2006-02-15 21:30:53","BAREFOOT MANCHURIAN","A Intrepid Story of a Cat And a Student who must Vanquish a Girl in An Abandoned Amusement Park",2006,English,NULL,6,G,"47 MySakila Drive",Lethbridge,52535,69493378813,"FRANCES PARKER",FRANCES.PARKER@sakilacustomer.org,"Mike Hillyer",Mike.Hillyer@sakilastaff.com,1,1292,6.99,"2005-05-26 20:57:00"
301,"2005-05-26 21:06:14",3448,274,"2005-06-01 01:54:14","2006-02-15 21:30:53","SADDLE ANTITRUST","A Stunning Epistle of a Feminist And a A Shark who must Battle a Woman in An Abandoned Fun House",2006,English,NULL,7,PG-13,"28 MySQL Boulevard",Woodridge,85548,959949395183,"NAOMI JENNINGS",NAOMI.JENNINGS@sakilacustomer.org,"Jon Stephens",Jon.Stephens@sakilastaff.com,2,7404,2.99,"2005-05-26 21:06:14"
302,"2005-05-26 21:13:46",2921,387,"2005-06-03 15:49:46","2006-02-15 21:30:53","ORANGE GRAPES","A Astounding Documentary of a Butler And a Womanizer who must Face a Dog in A U-Boat",2006,English,NULL,4,PG-13,"28 MySQL Boulevard",Woodridge,69973,900235712074,"JESSE SCHILLING",JESSE.SCHILLING@sakilacustomer.org,"Jon Stephens",Jon.Stephens@sakilastaff.com,2,10473,4.99,"2005-05-26 21:13:46"
303,"2005-05-26 21:16:52",1111,596,"2005-05-27 23:41:52","2006-02-15 21:30:53","DOUBTFIRE LABYRINTH","A Intrepid Panorama of a Butler And a Composer who must Meet a Mad Cow in The Sahara Desert",2006,English,NULL,5,R,"28 MySQL Boulevard",Woodridge,97661,199514580428,"ENRIQUE FORSYTHE",ENRIQUE.FORSYTHE@sakilacustomer.org,"Jon Stephens",Jon.Stephens@sakilastaff.com,2,15956,4.99,"2005-05-26 21:16:52"
304,"2005-05-26 21:21:28",1701,534,"2005-06-02 00:05:28","2006-02-15 21:30:53","GORGEOUS BINGO","A Action-Packed Display of a Sumo Wrestler And a Car who must Overcome a Waitress in A Baloon Factory",2006,English,NULL,4,R,"28 MySQL Boulevard",Woodridge,67521,122981120653,"CHRISTIAN JUNG",CHRISTIAN.JUNG@sakilacustomer.org,"Jon Stephens",Jon.Stephens@sakilastaff.com,2,14372,5.99,"2005-05-26 21:21:28"
305,"2005-05-26 21:22:07",2665,464,"2005-06-02 22:33:07","2006-02-15 21:30:53","MOB DUFFEL","A Unbelieveable Documentary of a Frisbee And a Boat who must Meet a Boy in The Canadian Rockies",2006,English,NULL,4,G,"28 MySQL Boulevard",Woodridge,7939,928809465153,"JEROME KENYON",JEROME.KENYON@sakilacustomer.org,"Jon Stephens",Jon.Stephens@sakilastaff.com,1,12526,3.99,"2005-05-26 21:22:07"
306,"2005-05-26 21:31:57",2781,547,"2005-05-28 19:37:57","2006-02-15 21:30:53","MUSIC BOONDOCK","A Thrilling Tale of a Butler And a Astronaut who must Battle a Explorer in The First Manned Space Station",2006,English,NULL,7,R,"28 MySQL Boulevard",Woodridge,19151,135407755975,"KURT EMMONS",KURT.EMMONS@sakilacustomer.org,"Jon Stephens",Jon.Stephens@sakilastaff.com,1,14686,0.99,"2005-05-26 21:31:57"
307,"2005-05-26 21:48:13",1097,375,"2005-06-04 22:24:13","2006-02-15 21:30:53","DORADO NOTTING","A Action-Packed Tale of a Sumo Wrestler And a A Shark who must Meet a Frisbee in California",2006,English,NULL,5,NC-17,"47 MySakila Drive",Lethbridge,22025,409315295763,"AARON SELBY",AARON.SELBY@sakilacustomer.org,"Mike Hillyer",Mike.Hillyer@sakilastaff.com,2,10151,8.99,"2005-05-26 21:48:13"
308,"2005-05-26 22:01:39",187,277,"2005-06-04 20:24:39","2006-02-15 21:30:53","ARTIST COLDBLOODED","A Stunning Reflection of a Robot And a Moose who must Challenge a Woman in California",2006,English,NULL,5,NC-17,"28 MySQL Boulevard",Woodridge,55802,363982224739,"OLGA JIMENEZ",OLGA.JIMENEZ@sakilacustomer.org,"Jon Stephens",Jon.Stephens@sakilastaff.com,2,7495,6.99,"2005-05-26 22:01:39"
309,"2005-05-26 22:38:10",1946,251,"2005-06-02 03:10:10","2006-02-15 21:30:53","HOLOCAUST HIGHBALL","A Awe-Inspiring Yarn of a Composer And a Man who must Find a Robot in Soviet Georgia",2006,English,NULL,6,R,"47 MySakila Drive",Lethbridge,36481,567359279425,"VICKIE BREWER",VICKIE.BREWER@sakilacustomer.org,"Mike Hillyer",Mike.Hillyer@sakilastaff.com,1,6758,1.99,"2005-05-26 22:38:10"
310,"2005-05-26 22:41:07",593,409,"2005-06-02 04:09:07","2006-02-15 21:30:53","CAUSE DATE","A Taut Tale of a Explorer And a Pastry Chef who must Conquer a Hunter in A MySQL Convention",2006,English,NULL,3,R,"28 MySQL Boulevard",Woodridge,7122,653436985797,"RODNEY MOELLER",RODNEY.MOELLER@sakilacustomer.org,"Jon Stephens",Jon.Stephens@sakilastaff.com,1,11062,6.99,"2005-05-26 22:41:07"
311,"2005-05-26 22:51:37",2830,201,"2005-06-01 00:02:37","2006-02-15 21:30:53","NETWORK PEAK","A Unbelieveable Reflection of a Butler And a Boat who must Outgun a Mad Scientist in California",2006,English,NULL,5,PG-13,"47 MySakila Drive",Lethbridge,4662,146640639760,"VICKI FIELDS",VICKI.FIELDS@sakilacustomer.org,"Mike Hillyer",Mike.Hillyer@sakilastaff.com,1,5445,3.99,"2005-05-26 22:51:37"
312,"2005-05-26 22:52:19",2008,143,"2005-06-02 18:14:19","2006-02-15 21:30:53","HOUSE DYNAMITE","A Taut Story of a Pioneer And a Squirrel who must Battle a Student in Soviet Georgia",2006,English,NULL,7,R,"28 MySQL Boulevard",Woodridge,97700,923261616249,"LESLIE GORDON",LESLIE.GORDON@sakilacustomer.org,"Jon Stephens",Jon.Stephens@sakilastaff.com,1,3858,2.99,"2005-05-26 22:52:19"
313,"2005-05-26 22:56:19",4156,594,"2005-05-29 01:29:19","2006-02-15 21:30:53","TRADING PINOCCHIO","A Emotional Character Study of a Student And a Explorer who must Discover a Frisbee in The First Manned Space Station",2006,English,NULL,6,PG,"28 MySQL Boulevard",Woodridge,82580,640843562301,"EDUARDO HIATT",EDUARDO.HIATT@sakilacustomer.org,"Jon Stephens",Jon.Stephens@sakilastaff.com,1,15899,4.99,"2005-05-26 22:56:19"
314,"2005-05-26 23:09:41",2851,203,"2005-05-28 22:49:41","2006-02-15 21:30:53","NONE SPIKING","A Boring Reflection of a Secret Agent And a Astronaut who must Face a Composer in A Manhattan Penthouse",2006,English,NULL,3,NC-17,"47 MySakila Drive",Lethbridge,61613,652218196731,"TARA RYAN",TARA.RYAN@sakilacustomer.org,"Mike Hillyer",Mike.Hillyer@sakilastaff.com,1,5496,0.99,"2005-05-26 23:09:41"
315,"2005-05-26 23:12:55",2847,238,"2005-05-29 23:33:55","2006-02-15 21:30:53","NIGHTMARE CHILL","A Brilliant Display of a Robot And a Butler who must Fight a Waitress in An Abandoned Mine Shaft",2006,English,NULL,3,PG,"28 MySQL Boulevard",Woodridge,14408,918119601885,"NELLIE GARRETT",NELLIE.GARRETT@sakilacustomer.org,"Jon Stephens",Jon.Stephens@sakilastaff.com,2,6419,4.99,"2005-05-26 23:12:55"
316,"2005-05-26 23:22:55",3828,249,"2005-05-29 23:25:55","2006-02-15 21:30:53","STAGECOACH ARMAGEDDON","A Touching Display of a Pioneer And a Butler who must Chase a Car in California",2006,English,NULL,5,R,"28 MySQL Boulevard",Woodridge,38140,56257502250,"DORA MEDINA",DORA.MEDINA@sakilacustomer.org,"Jon Stephens",Jon.Stephens@sakilastaff.com,2,6714,4.99,"2005-05-26 23:22:55"
317,"2005-05-26 23:23:56",26,391,"2005-06-01 19:56:56","2006-02-15 21:30:53","AGENT TRUMAN","A Intrepid Panorama of a Robot And a Boy who must Escape a Sumo Wrestler in Ancient China",2006,English,NULL,3,PG,"47 MySakila Drive",Lethbridge,83536,667736124769,"CLARENCE GAMEZ",CLARENCE.GAMEZ@sakilacustomer.org,"Mike Hillyer",Mike.Hillyer@sakilastaff.com,1,10590,5.99,"2005-05-26 23:23:56"
318,"2005-05-26 23:37:39",2559,60,"2005-06-03 04:31:39","2006-02-15 21:30:53","MASK PEACH","A Boring Character Study of a Student And a Robot who must Meet a Woman in California",2006,English,NULL,6,NC-17,"47 MySakila Drive",Lethbridge,55561,250767749542,"MILDRED BAILEY",MILDRED.BAILEY@sakilacustomer.org,"Mike Hillyer",Mike.Hillyer@sakilastaff.com,1,1647,4.99,"2005-05-26 23:37:39"
319,"2005-05-26 23:52:13",3024,77,"2005-05-30 18:55:13","2006-02-15 21:30:53","PATRIOT ROMAN","A Taut Saga of a Robot And a Database Administrator who must Challenge a Astronaut in California",2006,English,NULL,6,PG,"47 MySakila Drive",Lethbridge,9223,918711376618,"JANE BENNETT",JANE.BENNETT@sakilacustomer.org,"Mike Hillyer",Mike.Hillyer@sakilastaff.com,2,2085,2.99,"2005-05-26 23:52:13"
320,"2005-05-27 00:09:24",1090,2,"2005-05-28 04:30:24","2006-02-15 21:30:53","DOORS PRESIDENT","A Awe-Inspiring Display of a Squirrel And a Woman who must Overcome a Boy in The Gulf of Mexico",2006,English,NULL,3,NC-17,"47 MySakila Drive",Lethbridge,17886,838635286649,"PATRICIA JOHNSON",PATRICIA.JOHNSON@sakilacustomer.org,"Mike Hillyer",Mike.Hillyer@sakilastaff.com,1,33,4.99,"2005-05-27 00:09:24"
322,"2005-05-27 00:47:35",4556,496,"2005-06-02 00:32:35","2006-02-15 21:30:53","WYOMING STORM","A Awe-Inspiring Panorama of a Robot And a Boat who must Overcome a Feminist in A U-Boat",2006,English,NULL,6,PG-13,"47 MySakila Drive",Lethbridge,72349,211256301880,"TYLER WREN",TYLER.WREN@sakilacustomer.org,"Mike Hillyer",Mike.Hillyer@sakilastaff.com,2,13356,4.99,"2005-05-27 00:47:35"
323,"2005-05-27 00:49:27",2362,144,"2005-05-30 03:12:27","2006-02-15 21:30:53","LEBOWSKI SOLDIERS","A Beautiful Epistle of a Secret Agent And a Pioneer who must Chase a Astronaut in Ancient China",2006,English,NULL,6,PG-13,"28 MySQL Boulevard",Woodridge,30861,563660187896,"CLARA SHAW",CLARA.SHAW@sakilacustomer.org,"Jon Stephens",Jon.Stephens@sakilastaff.com,1,3879,2.99,"2005-05-27 00:49:27"
324,"2005-05-27 01:00:04",3364,292,"2005-05-30 04:27:04","2006-02-15 21:30:53","ROCKETEER MOTHER","A Awe-Inspiring Character Study of a Robot And a Sumo Wrestler who must Discover a Womanizer in A Shark Tank",2006,English,NULL,3,PG-13,"28 MySQL Boulevard",Woodridge,19065,350970907017,"MISTY LAMBERT",MISTY.LAMBERT@sakilacustomer.org,"Jon Stephens",Jon.Stephens@sakilastaff.com,1,7895,0.99,"2005-05-27 01:00:04"
325,"2005-05-27 01:09:55",2510,449,"2005-05-31 07:01:55","2006-02-15 21:30:53","MAIDEN HOME","A Lacklusture Saga of a Moose And a Teacher who must Kill a Forensic Psychologist in A MySQL Convention",2006,English,NULL,3,PG,"28 MySQL Boulevard",Woodridge,21872,474047727727,"OSCAR AQUINO",OSCAR.AQUINO@sakilacustomer.org,"Jon Stephens",Jon.Stephens@sakilastaff.com,2,12115,5.99,"2005-05-27 01:09:55"
326,"2005-05-27 01:10:11",3979,432,"2005-06-04 20:25:11","2006-02-15 21:30:53","SUPER WYOMING","A Action-Packed Saga of a Pastry Chef And a Explorer who must Discover a A Shark in The Outback",2006,English,NULL,5,PG,"47 MySakila Drive",Lethbridge,63104,617567598243,"EDWIN BURK",EDWIN.BURK@sakilacustomer.org,"Mike Hillyer",Mike.Hillyer@sakilastaff.com,2,11643,7.99,"2005-05-27 01:10:11"
327,"2005-05-27 01:18:57",2678,105,"2005-06-04 04:06:57","2006-02-15 21:30:53","MODEL FISH","A Beautiful Panorama of a Boat And a Crocodile who must Outrace a Dog in Australia",2006,English,NULL,4,NC-17,"28 MySQL Boulevard",Woodridge,76383,963887147572,"DAWN SULLIVAN",DAWN.SULLIVAN@sakilacustomer.org,"Jon Stephens",Jon.Stephens@sakilastaff.com,1,2824,8.99,"2005-05-27 01:18:57"
328,"2005-05-27 01:29:31",2524,451,"2005-06-01 02:27:31","2006-02-15 21:30:53","MALKOVICH PET","A Intrepid Reflection of a Waitress And a A Shark who must Kill a Squirrel in The Outback",2006,English,NULL,6,G,"28 MySQL Boulevard",Woodridge,48745,524567129902,"JIM REA",JIM.REA@sakilacustomer.org,"Jon Stephens",Jon.Stephens@sakilastaff.com,2,12161,2.99,"2005-05-27 01:29:31"
329,"2005-05-27 01:57:14",2659,231,"2005-05-31 04:19:14","2006-02-15 21:30:53","MISSION ZOOLANDER","A Intrepid Story of a Sumo Wrestler And a Teacher who must Meet a A Shark in An Abandoned Fun House",2006,English,NULL,3,PG-13,"28 MySQL Boulevard",Woodridge,42420,541327526474,"GEORGIA JACOBS",GEORGIA.JACOBS@sakilacustomer.org,"Jon Stephens",Jon.Stephens@sakilastaff.com,1,6219,5.99,"2005-05-27 01:57:14"
