725,"2005-05-29 06:03:41",4088,245,"2005-06-03 08:52:41","2006-02-15 21:30:53","TIMBERLAND SKY","A Boring Display of a Man And a Dog who must Redeem a Girl in A U-Boat",2006,English,NULL,3,G,"47 MySakila Drive",Lethbridge,81314,890289150158,"COURTNEY DAY",COURTNEY.DAY@sakilacustomer.org,"Mike Hillyer",Mike.Hillyer@sakilastaff.com,2,6626,2.99,"2005-05-29 06:03:41"
726,"2005-05-29 06:05:29",933,452,"2005-06-05 04:40:29","2006-02-15 21:30:53","DANCING FEVER","A Stunning Story of a Explorer And a Forensic Psychologist who must Face a Crocodile in A Shark Tank",2006,English,NULL,6,G,"28 MySQL Boulevard",Woodridge,41136,985109775584,"TOM MILNER",TOM.MILNER@sakilacustomer.org,"Jon Stephens",Jon.Stephens@sakilastaff.com,1,12195,1.99,"2005-05-29 06:05:29"
727,"2005-05-29 06:08:15",1629,484,"2005-05-30 07:16:15","2006-02-15 21:30:53","GIANT TROOPERS","A Fateful Display of a Feminist And a Monkey who must Vanquish a Monkey in The Canadian Rockies",2006,English,NULL,5,R,"47 MySakila Drive",Lethbridge,11839,508348602835,"ROBERTO VU",ROBERTO.VU@sakilacustomer.org,"Mike Hillyer",Mike.Hillyer@sakilastaff.com,2,13057,2.99,"2005-05-29 06:08:15"
728,"2005-05-29 06:12:38",242,551,"2005-06-03 07:41:38","2006-02-15 21:30:53","BARBARELLA STREETCAR","A Awe-Inspiring Story of a Feminist And a Cat who must Conquer a Dog in A Monastery",2006,English,NULL,6,G,"47 MySakila Drive",Lethbridge,26284,380077794770,"CLAYTON BARBEE",CLAYTON.BARBEE@sakilacustomer.org,"Mike Hillyer",Mike.Hillyer@sakilastaff.com,1,14781,2.99,"2005-05-29 06:12:38"
729,"2005-05-29 06:35:13",1688,323,"2005-06-04 03:23:13","2006-02-15 21:30:53","GONE TROUBLE","A Insightful Character Study of a Mad Cow And a Forensic Psychologist who must Conquer a A Shark in A Manhattan Penthouse",2006,English,NULL,7,R,"47 MySakila Drive",Lethbridge,54949,869051782691,"MATTHEW MAHAN",MATTHEW.MAHAN@sakilacustomer.org,"Mike Hillyer",Mike.Hillyer@sakilastaff.com,2,8724,2.99,"2005-05-29 06:35:13"
730,"2005-05-29 07:00:59",3473,197,"2005-06-06 01:17:59","2006-02-15 21:30:53","SANTA PARIS","A Emotional Documentary of a Moose And a Car who must Redeem a Mad Cow in A Baloon Factory",2006,English,NULL,7,PG,"28 MySQL Boulevard",Woodridge,89459,264286442804,"SUE PETERS",SUE.PETERS@sakilacustomer.org,"Jon Stephens",Jon.Stephens@sakilastaff.com,2,5321,3.99,"2005-05-29 07:00:59"
731,"2005-05-29 07:25:16",4124,5,"2005-05-30 05:21:16","2006-02-15 21:30:53","TOOTSIE PILOT","A Awe-Inspiring Documentary of a Womanizer And a Pastry Chef who must Kill a Lumberjack in Berlin",2006,English,NULL,3,PG,"28 MySQL Boulevard",Woodridge,42399,10655648674,"ELIZABETH BROWN",ELIZABETH.BROWN@sakilacustomer.org,"Jon Stephens",Jon.Stephens@sakilastaff.com,1,108,0.99,"2005-05-29 07:25:16"
732,"2005-05-29 07:32:51",2530,447,"2005-05-30 10:08:51","2006-02-15 21:30:53","MALLRATS UNITED","A Thrilling Yarn of a Waitress And a Dentist who must Find a Hunter in A Monastery",2006,English,NULL,4,PG,"28 MySQL Boulevard",Woodridge,52671,782900030287,"CLIFFORD BOWENS",CLIFFORD.BOWENS@sakilacustomer.org,"Jon Stephens",Jon.Stephens@sakilastaff.com,2,12057,0.99,"2005-05-29 07:32:51"
733,"2005-05-29 07:35:21",2951,363,"2005-06-05 09:14:21","2006-02-15 21:30:53","OUTFIELD MASSACRE","A Thoughtful Drama of a Husband And a Secret Agent who must Pursue a Database Administrator in Ancient India",2006,English,NULL,4,NC-17,"28 MySQL Boulevard",Woodridge,96584,568367775448,"ROY WHITING",ROY.WHITING@sakilacustomer.org,"Jon Stephens",Jon.Stephens@sakilastaff.com,1,9806,3.99,"2005-05-29 07:35:21"
734,"2005-05-29 07:38:52",3084,538,"2005-06-03 10:17:52","2006-02-15 21:30:53","PICKUP DRIVING","A Touching Documentary of a Husband And a Boat who must Meet a Pastry Chef in A Baloon Factory",2006,English,NULL,3,G,"47 MySakila Drive",Lethbridge,69953,488600270038,"TED BREAUX",TED.BREAUX@sakilacustomer.org,"Mike Hillyer",Mike.Hillyer@sakilastaff.com,2,14479,4.99,"2005-05-29 07:38:52"
735,"2005-05-29 08:08:13",3421,454,"2005-06-07 13:35:13","2006-02-15 21:30:53","RULES HUMAN","A Beautiful Epistle of a Astronaut And a Student who must Confront a Monkey in An Abandoned Fun House",2006,English,NULL,6,R,"28 MySQL Boulevard",Woodridge,16119,118011831565,"ALEX GRESHAM",ALEX.GRESHAM@sakilacustomer.org,"Jon Stephens",Jon.Stephens@sakilastaff.com,1,12248,7.99,"2005-05-29 08:08:13"
736,"2005-05-29 08:10:07",3689,276,"2005-06-05 10:21:07","2006-02-15 21:30:53","SLEUTH ORIENT","A Fateful Character Study of a Husband And a Dog who must Find a Feminist in Ancient India",2006,English,NULL,4,NC-17,"47 MySakila Drive",Lethbridge,24645,75975221996,"BRANDY GRAVES",BRANDY.GRAVES@sakilacustomer.org,"Mike Hillyer",Mike.Hillyer@sakilastaff.com,1,7467,3.99,"2005-05-29 08:10:07"
737,"2005-05-29 08:11:31",769,589,"2005-06-04 11:18:31","2006-02-15 21:30:53","COMA HEAD","A Awe-Inspiring Drama of a Boy And a Frisbee who must Escape a Pastry Chef in California",2006,English,NULL,6,NC-17,"28 MySQL Boulevard",Woodridge,22474,154124128457,"TRACY HERRMANN",TRACY.HERRMANN@sakilacustomer.org,"Jon Stephens",Jon.Stephens@sakilastaff.com,1,15766,4.99,"2005-05-29 08:11:31"
738,"2005-05-29 08:20:08",2284,256,"2005-06-06 08:59:08","2006-02-15 21:30:53","KARATE MOON","A Astounding Yarn of a Womanizer And a Dog who must Reach a Waitress in A MySQL Convention",2006,English,NULL,4,PG-13,"47 MySakila Drive",Lethbridge,68146,884536620568,"MABEL HOLLAND",MABEL.HOLLAND@sakilacustomer.org,"Mike Hillyer",Mike.Hillyer@sakilastaff.com,2,6891,4.99,"2005-05-29 08:20:08"
739,"2005-05-29 08:28:18",1183,84,"2005-06-06 09:21:18","2006-02-15 21:30:53","DURHAM PANKY","A Brilliant Panorama of a Girl And a Boy who must Face a Mad Scientist in An Abandoned Mine Shaft",2006,English,NULL,6,R,"28 MySQL Boulevard",Woodridge,67912,48417642933,"SARA PERRY",SARA.PERRY@sakilacustomer.org,"Jon Stephens",Jon.Stephens@sakilastaff.com,1,2270,6.99,"2005-05-29 08:28:18"
740,"2005-05-29 08:30:36",600,89,"2005-06-04 12:47:36","2006-02-15 21:30:53","CENTER DINOSAUR","A Beautiful Character Study of a Sumo Wrestler And a Dentist who must Find a Dog in California",2006,English,NULL,5,PG,"47 MySakila Drive",Lethbridge,75543,846225459260,"JULIA FLORES",JULIA.FLORES@sakilacustomer.org,"Mike Hillyer",Mike.Hillyer@sakilastaff.com,1,2411,5.99,"2005-05-29 08:30:36"
741,"2005-05-29 08:35:49",3189,495,"2005-06-04 11:55:49","2006-02-15 21:30:53","PRIX UNDEFEATED","A Stunning Saga of a Mad Scientist And a Boat who must Overcome a Dentist in Ancient China",2006,English,NULL,4,R,"28 MySQL Boulevard",Woodridge,98030,962020153680,"CHARLIE BESS",CHARLIE.BESS@sakilacustomer.org,"Jon Stephens",Jon.Stephens@sakilastaff.com,2,13331,4.99,"2005-05-29 08:35:49"
742,"2005-05-29 08:36:30",273,483,"2005-06-05 11:30:30","2006-02-15 21:30:53","BEAUTY GREASE","A Fast-Paced Display of a Composer And a Moose who must Sink a Robot in An Abandoned Mine Shaft",2006,English,NULL,5,G,"47 MySakila Drive",Lethbridge,2596,975185523021,"VERNON CHAPA",VERNON.CHAPA@sakilacustomer.org,"Mike Hillyer",Mike.Hillyer@sakilastaff.com,2,13037,6.99,"2005-05-29 08:36:30"
743,"2005-05-29 08:39:02",2528,548,"2005-06-06 08:42:02","2006-02-15 21:30:53","MALLRATS UNITED","A Thrilling Yarn of a Waitress And a Dentist who must Find a Hunter in A Monastery",2006,English,NULL,4,PG,"28 MySQL Boulevard",Woodridge,841,50898428626,"ALLAN CORNISH",ALLAN.CORNISH@sakilacustomer.org,"Jon Stephens",Jon.Stephens@sakilastaff.com,1,14710,4.99,"2005-05-29 08:39:02"
744,"2005-05-29 09:13:08",3722,420,"2005-06-01 07:05:08","2006-02-15 21:30:53","SNATCH SLIPPER","A Insightful Panorama of a Woman And a Feminist who must Defeat a Forensic Psychologist in Berlin",2006,English,NULL,6,PG,"47 MySakila Drive",Lethbridge,89420,546793516940,"JACOB LANCE",JACOB.LANCE@sakilacustomer.org,"Mike Hillyer",Mike.Hillyer@sakilastaff.com,2,11350,4.99,"2005-05-29 09:13:08"
745,"2005-05-29 09:22:57",581,152,"2005-06-01 09:10:57","2006-02-15 21:30:53","CAT CONEHEADS","A Fast-Paced Panorama of a Girl And a A Shark who must Confront a Boy in Ancient India",2006,English,NULL,5,G,"47 MySakila Drive",Lethbridge,64863,761379480249,"ALICIA MILLS",ALICIA.MILLS@sakilacustomer.org,"Mike Hillyer",Mike.Hillyer@sakilastaff.com,1,4137,4.99,"2005-05-29 09:22:57"
746,"2005-05-29 09:25:10",4272,130,"2005-06-02 04:20:10","2006-02-15 21:30:53","VACATION BOONDOCK","A Fanciful Character Study of a Secret Agent And a Mad Scientist who must Reach a Teacher in Australia",2006,English,NULL,4,R,"47 MySakila Drive",Lethbridge,82639,935448624185,"CHARLOTTE HUNTER",CHARLOTTE.HUNTER@sakilacustomer.org,"Mike Hillyer",Mike.Hillyer@sakilastaff.com,1,3505,2.99,"2005-05-29 09:25:10"
747,"2005-05-29 09:26:34",1993,291,"2005-06-05 07:28:34","2006-02-15 21:30:53","HORROR REIGN","A Touching Documentary of a A Shark And a Car who must Build a Husband in Nigeria",2006,English,NULL,3,R,"47 MySakila Drive",Lethbridge,61195,976798660411,"TONI HOLT",TONI.HOLT@sakilacustomer.org,"Mike Hillyer",Mike.Hillyer@sakilastaff.com,2,7873,4.99,"2005-05-29 09:26:34"
748,"2005-05-29 09:27:00",2803,7,"2005-06-03 04:25:00","2006-02-15 21:30:53","NASH CHOCOLAT","A Epic Reflection of a Monkey And a Mad Cow who must Kill a Forensic Psychologist in An Abandoned Mine Shaft",2006,English,NULL,6,PG-13,"28 MySQL Boulevard",Woodridge,93896,716571220373,"MARIA MILLER",MARIA.MILLER@sakilacustomer.org,"Jon Stephens",Jon.Stephens@sakilastaff.com,2,176,2.99,"2005-05-29 09:27:00"
749,"2005-05-29 09:33:33",1146,375,"2005-05-31 11:45:33","2006-02-15 21:30:53","DRIFTER COMMANDMENTS","A Epic Reflection of a Womanizer And a Squirrel who must Discover a Husband in A Jet Boat",2006,English,NULL,5,PG-13,"28 MySQL Boulevard",Woodridge,22025,409315295763,"AARON SELBY",AARON.SELBY@sakilacustomer.org,"Jon Stephens",Jon.Stephens@sakilastaff.com,2,10153,4.99,"2005-05-29 09:33:33"
750,"2005-05-29 09:41:40",730,269,"2005-05-30 13:31:40","2006-02-15 21:30:53","CLOSER BANG","A Unbelieveable Panorama of a Frisbee And a Hunter who must Vanquish a Monkey in Ancient India",2006,English,NULL,5,R,"28 MySQL Boulevard",Woodridge,75090,685010736240,"CASSANDRA WALTERS",CASSANDRA.WALTERS@sakilacustomer.org,"Jon Stephens",Jon.Stephens@sakilastaff.com,1,7278,4.99,"2005-05-29 09:41:40"
751,"2005-05-29 09:55:43",2711,53,"2005-06-02 04:54:43","2006-02-15 21:30:53","MOON BUNCH","A Beautiful Tale of a Astronaut And a Mad Cow who must Challenge a Cat in A Baloon Factory",2006,English,NULL,7,PG,"28 MySQL Boulevard",Woodridge,38594,697760867968,"HEATHER MORRIS",HEATHER.MORRIS@sakilacustomer.org,"Jon Stephens",Jon.Stephens@sakilastaff.com,1,1456,0.99,"2005-05-29 09:55:43"
752,"2005-05-29 10:14:15",1720,126,"2005-06-04 06:30:15","2006-02-15 21:30:53","GRAIL FRANKENSTEIN","A Unbelieveable Saga of a Teacher And a Monkey who must Fight a Girl in An Abandoned Mine Shaft",2006,English,NULL,4,NC-17,"47 MySakila Drive",Lethbridge,66255,582835362905,"ELLEN SIMPSON",ELLEN.SIMPSON@sakilacustomer.org,"Mike Hillyer",Mike.Hillyer@sakilastaff.com,1,3387,4.99,"2005-05-29 10:14:15"
753,"2005-05-29 10:16:42",1021,135,"2005-06-05 08:52:42","2006-02-15 21:30:53","DETECTIVE VISION","A Fanciful Documentary of a Pioneer And a Woman who must Redeem a Hunter in Ancient Japan",2006,English,NULL,4,PG-13,"28 MySQL Boulevard",Woodridge,5892,90921003005,"JUANITA MASON",JUANITA.MASON@sakilacustomer.org,"Jon Stephens",Jon.Stephens@sakilastaff.com,2,3637,3.99,"2005-05-29 10:16:42"
754,"2005-05-29 10:18:59",734,281,"2005-06-04 05:03:59","2006-02-15 21:30:53","CLUB GRAFFITI","A Epic Tale of a Pioneer And a Hunter who must Escape a Girl in A U-Boat",2006,English,NULL,4,PG-13,"28 MySQL Boulevard",Woodridge,30657,583021225407,"LEONA OBRIEN",LEONA.OBRIEN@sakilacustomer.org,"Jon Stephens",Jon.Stephens@sakilastaff.com,2,7612,2.99,"2005-05-29 10:18:59"
755,"2005-05-29 10:26:29",3090,576,"2005-06-01 10:25:29","2006-02-15 21:30:53","PILOT HOOSIERS","A Awe-Inspiring Reflection of a Crocodile And a Sumo Wrestler who must Meet a Forensic Psychologist in An Abandoned Mine Shaft",2006,English,NULL,6,PG,"28 MySQL Boulevard",Woodridge,34750,278669994384,"MORRIS MCCARTER",MORRIS.MCCARTER@sakilacustomer.org,"Jon Stephens",Jon.Stephens@sakilastaff.com,2,15423,2.99,"2005-05-29 10:26:29"
756,"2005-05-29 10:28:45",3152,201,"2005-06-04 12:50:45","2006-02-15 21:30:53","POTLUCK MIXED","A Beautiful Story of a Dog And a Technical Writer who must Outgun a Student in A Baloon",2006,English,NULL,3,G,"28 MySQL Boulevard",Woodridge,4662,146640639760,"VICKI FIELDS",VICKI.FIELDS@sakilacustomer.org,"Jon Stephens",Jon.Stephens@sakilastaff.com,2,5447,5.99,"2005-05-29 10:28:45"
757,"2005-05-29 10:29:47",1067,435,"2005-06-07 15:27:47","2006-02-15 21:30:53","DOCTOR GRAIL","A Insightful Drama of a Womanizer And a Waitress who must Reach a Forensic Psychologist in The Outback",2006,English,NULL,4,G,"47 MySakila Drive",Lethbridge,90920,746251338300,"RICKY SHELBY",RICKY.SHELBY@sakilacustomer.org,"Mike Hillyer",Mike.Hillyer@sakilastaff.com,1,11718,7.99,"2005-05-29 10:29:47"
758,"2005-05-29 10:31:56",1191,563,"2005-06-01 14:53:56","2006-02-15 21:30:53","DYING MAKER","A Intrepid Tale of a Boat And a Monkey who must Kill a Cat in California",2006,English,NULL,5,PG,"47 MySakila Drive",Lethbridge,10714,997453607116,"KEN PREWITT",KEN.PREWITT@sakilacustomer.org,"Mike Hillyer",Mike.Hillyer@sakilastaff.com,1,15073,4.99,"2005-05-29 10:31:56"
759,"2005-05-29 10:57:57",2367,179,"2005-06-07 16:23:57","2006-02-15 21:30:53","LEGALLY SECRETARY","A Astounding Tale of a A Shark And a Moose who must Meet a Womanizer in The Sahara Desert",2006,English,NULL,7,PG,"28 MySQL Boulevard",Woodridge,35109,866092335135,"DANA HART",DANA.HART@sakilacustomer.org,"Jon Stephens",Jon.Stephens@sakilastaff.com,1,4863,6.99,"2005-05-29 10:57:57"
760,"2005-05-29 11:07:25",3250,77,"2005-06-02 14:16:25","2006-02-15 21:30:53","RANGE MOONWALKER","A Insightful Documentary of a Hunter And a Dentist who must Confront a Crocodile in A Baloon",2006,English,NULL,3,PG,"28 MySQL Boulevard",Woodridge,9223,918711376618,"JANE BENNETT",JANE.BENNETT@sakilacustomer.org,"Jon Stephens",Jon.Stephens@sakilastaff.com,1,2089,5.99,"2005-05-29 11:07:25"
761,"2005-05-29 11:09:01",2342,58,"2005-06-03 16:18:01","2006-02-15 21:30:53","LANGUAGE COWBOY","A Epic Yarn of a Cat And a Madman who must Vanquish a Dentist in An Abandoned Amusement Park",2006,English,NULL,5,NC-17,"28 MySQL Boulevard",Woodridge,69226,212869228936,"JEAN BELL",JEAN.BELL@sakilacustomer.org,"Jon Stephens",Jon.Stephens@sakilastaff.com,2,1595,0.99,"2005-05-29 11:09:01"
762,"2005-05-29 11:15:51",3683,146,"2005-06-06 07:48:51","2006-02-15 21:30:53","SLEEPLESS MONSOON","A Amazing Saga of a Moose And a Pastry Chef who must Escape a Butler in Australia",2006,English,NULL,5,G,"28 MySQL Boulevard",Woodridge,90732,206841104594,"JAMIE RICE",JAMIE.RICE@sakilacustomer.org,"Jon Stephens",Jon.Stephens@sakilastaff.com,2,3949,7.99,"2005-05-29 11:15:51"
763,"2005-05-29 11:32:15",2022,50,"2005-05-31 17:31:15","2006-02-15 21:30:53","HUNCHBACK IMPOSSIBLE","A Touching Yarn of a Frisbee And a Dentist who must Fight a Composer in Ancient Japan",2006,English,NULL,4,PG-13,"28 MySQL Boulevard",Woodridge,80168,307703950263,"DIANE COLLINS",DIANE.COLLINS@sakilacustomer.org,"Jon Stephens",Jon.Stephens@sakilastaff.com,1,1357,4.99,"2005-05-29 11:32:15"
764,"2005-05-29 11:37:35",1069,149,"2005-05-31 16:47:35","2006-02-15 21:30:53","DOGMA FAMILY","A Brilliant Character Study of a Database Administrator And a Monkey who must Succumb a Astronaut in New Orleans",2006,English,NULL,5,G,"47 MySakila Drive",Lethbridge,25545,885899703621,"VALERIE BLACK",VALERIE.BLACK@sakilacustomer.org,"Mike Hillyer",Mike.Hillyer@sakilastaff.com,1,4058,4.99,"2005-05-29 11:37:35"
765,"2005-05-29 11:38:34",515,69,"2005-06-02 17:04:34","2006-02-15 21:30:53","CAMELOT VACATION","A Touching Character Study of a Woman And a Waitress who must Battle a Pastry Chef in A MySQL Convention",2006,English,NULL,3,NC-17,"47 MySakila Drive",Lethbridge,59025,107137400143,"JUDY GRAY",JUDY.GRAY@sakilacustomer.org,"Mike Hillyer",Mike.Hillyer@sakilastaff.com,2,1868,1.99,"2005-05-29 11:38:34"
766,"2005-05-29 11:47:02",2154,383,"2005-06-06 07:14:02","2006-02-15 21:30:53","INTERVIEW LIAISONS","A Action-Packed Reflection of a Student And a Butler who must Discover a Database Administrator in A Manhattan Penthouse",2006,English,NULL,4,R,"28 MySQL Boulevard",Woodridge,17165,106439158941,"MARTIN BALES",MARTIN.BALES@sakilacustomer.org,"Jon Stephens",Jon.Stephens@sakilastaff.com,1,10367,8.99,"2005-05-29 11:47:02"
767,"2005-05-29 12:20:19",687,67,"2005-06-02 14:15:19","2006-02-15 21:30:53","CIDER DESIRE","A Stunning Character Study of a Composer And a Mad Cow who must Succumb a Cat in Soviet Georgia",2006,English,NULL,7,PG,"28 MySQL Boulevard",Woodridge,5135,947233365992,"KELLY TORRES",KELLY.TORRES@sakilacustomer.org,"Jon Stephens",Jon.Stephens@sakilastaff.com,1,1824,2.99,"2005-05-29 12:20:19"
768,"2005-05-29 12:30:46",2895,566,"2005-06-07 09:00:46","2006-02-15 21:30:53","OLEANDER CLUE","A Boring Story of a Teacher And a Monkey who must Succumb a Forensic Psychologist in A Jet Boat",2006,English,NULL,5,PG,"47 MySakila Drive",Lethbridge,52196,525518075499,"CASEY MENA",CASEY.MENA@sakilacustomer.org,"Mike Hillyer",Mike.Hillyer@sakilastaff.com,2,15156,4.99,"2005-05-29 12:30:46"
769,"2005-05-29 12:51:44",1523,575,"2005-06-01 17:43:44","2006-02-15 21:30:53","FREAKY POCUS","A Fast-Paced Documentary of a Pastry Chef And a Crocodile who must Chase a Squirrel in The Gulf of Mexico",2006,English,NULL,7,R,"47 MySakila Drive",Lethbridge,89422,14465669789,"ISAAC OGLESBY",ISAAC.OGLESBY@sakilacustomer.org,"Mike Hillyer",Mike.Hillyer@sakilastaff.com,2,15397,2.99,"2005-05-29 12:51:44"
770,"2005-05-29 12:56:50",2491,405,"2005-06-07 15:54:50","2006-02-15 21:30:53","MADRE GABLES","A Intrepid Panorama of a Sumo Wrestler And a Forensic Psychologist who must Discover a Moose in The First Manned Space Station",2006,English,NULL,7,PG-13,"28 MySQL Boulevard",Woodridge,86868,779461480495,"LEONARD SCHOFIELD",LEONARD.SCHOFIELD@sakilacustomer.org,"Jon Stephens",Jon.Stephens@sakilastaff.com,2,10942,4.99,"2005-05-29 12:56:50"
771,"2005-05-29 12:59:14",353,476,"2005-06-01 16:05:14","2006-02-15 21:30:53","BLACKOUT PRIVATE","A Intrepid Yarn of a Pastry Chef And a Mad Scientist who must Challenge a Secret Agent in Ancient Japan",2006,English,NULL,7,PG,"47 MySakila Drive",Lethbridge,20336,856872225376,"DERRICK BOURQUE",DERRICK.BOURQUE@sakilacustomer.org,"Mike Hillyer",Mike.Hillyer@sakilastaff.com,1,12864,2.99,"2005-05-29 12:59:14"
772,"2005-05-29 13:08:06",3319,556,"2005-06-06 08:19:06","2006-02-15 21:30:53","RIDGEMONT SUBMARINE","A Unbelieveable Drama of a Waitress And a Composer who must Sink a Mad Cow in Ancient Japan",2006,English,NULL,3,PG-13,"28 MySQL Boulevard",Woodridge,57380,590764256785,"ARMANDO GRUBER",ARMANDO.GRUBER@sakilacustomer.org,"Jon Stephens",Jon.Stephens@sakilastaff.com,2,14891,5.99,"2005-05-29 13:08:06"
773,"2005-05-29 13:18:05",245,563,"2005-06-07 17:22:05","2006-02-15 21:30:53","BARBARELLA STREETCAR","A Awe-Inspiring Story of a Feminist And a Cat who must Conquer a Dog in A Monastery",2006,English,NULL,6,G,"47 MySakila Drive",Lethbridge,10714,997453607116,"KEN PREWITT",KEN.PREWITT@sakilacustomer.org,"Mike Hillyer",Mike.Hillyer@sakilastaff.com,2,15074,5.99,"2005-05-29 13:18:05"
774,"2005-05-29 13:19:43",1188,575,"2005-06-01 18:51:43","2006-02-15 21:30:53","DYING MAKER","A Intrepid Tale of a Boat And a Monkey who must Kill a Cat in California",2006,English,NULL,5,PG,"47 MySakila Drive",Lethbridge,89422,14465669789,"ISAAC OGLESBY",ISAAC.OGLESBY@sakilacustomer.org,"Mike Hillyer",Mike.Hillyer@sakilastaff.com,1,15398,4.99,"2005-05-29 13:19:43"
775,"2005-05-29 13:23:26",1197,124,"2005-05-30 07:53:26","2006-02-15 21:30:53","DYNAMITE TARZAN","A Intrepid Documentary of a Forensic Psychologist And a Mad Scientist who must Face a Explorer in A U-Boat",2006,English,NULL,4,PG-13,"28 MySQL Boulevard",Woodridge,45142,614935229095,"SHEILA WELLS",SHEILA.WELLS@sakilacustomer.org,"Jon Stephens",Jon.Stephens@sakilastaff.com,1,3336,0.99,"2005-05-29 13:23:26"
776,"2005-05-29 13:35:35",4339,113,"2005-06-03 17:33:35","2006-02-15 21:30:53","VIRGINIAN PLUTO","A Emotional Panorama of a Dentist And a Crocodile who must Meet a Boy in Berlin",2006,English,NULL,5,R,"28 MySQL Boulevard",Woodridge,10885,358178933857,"CINDY FISHER",CINDY.FISHER@sakilacustomer.org,"Jon Stephens",Jon.Stephens@sakilastaff.com,2,3030,0.99,"2005-05-29 13:35:35"
777,"2005-05-29 14:07:58",451,360,"2005-06-03 08:41:58","2006-02-15 21:30:53","BROOKLYN DESERT","A Beautiful Drama of a Dentist And a Composer who must Battle a Sumo Wrestler in The First Manned Space Station",2006,English,NULL,7,R,"47 MySakila Drive",Lethbridge,64875,102396298916,"RALPH MADRIGAL",RALPH.MADRIGAL@sakilacustomer.org,"Mike Hillyer",Mike.Hillyer@sakilastaff.com,2,9710,4.99,"2005-05-29 14:07:58"
778,"2005-05-29 14:09:53",1816,535,"2005-06-05 20:05:53","2006-02-15 21:30:53","HANDICAP BOONDOCK","A Beautiful Display of a Pioneer And a Squirrel who must Vanquish a Sumo Wrestler in Soviet Georgia",2006,English,NULL,4,R,"47 MySakila Drive",Lethbridge,49250,8912935608,"JAVIER ELROD",JAVIER.ELROD@sakilacustomer.org,"Mike Hillyer",Mike.Hillyer@sakilastaff.com,1,14398,3.99,"2005-05-29 14:09:53"
779,"2005-05-29 14:17:17",533,105,"2005-06-06 16:46:17","2006-02-15 21:30:53","CANDLES GRAPES","A Fanciful Character Study of a Monkey And a Explorer who must Build a Astronaut in An Abandoned Fun House",2006,English,NULL,6,NC-17,"47 MySakila Drive",Lethbridge,76383,963887147572,"DAWN SULLIVAN",DAWN.SULLIVAN@sakilacustomer.org,"Mike Hillyer",Mike.Hillyer@sakilastaff.com,1,2827,6.99,"2005-05-29 14:17:17"
780,"2005-05-29 14:18:32",1919,300,"2005-06-06 20:14:32","2006-02-15 21:30:53","HILLS NEIGHBORS","A Epic Display of a Hunter And a Feminist who must Sink a Car in A U-Boat",2006,English,NULL,5,G,"47 MySakila Drive",Lethbridge,56883,51917807050,"JOHN FARNSWORTH",JOHN.FARNSWORTH@sakilacustomer.org,"Mike Hillyer",Mike.Hillyer@sakilastaff.com,1,8137,3.99,"2005-05-29 14:18:32"
781,"2005-05-29 14:23:58",88,313,"2005-05-30 17:44:58","2006-02-15 21:30:53","ALTER VICTORY","A Thoughtful Drama of a Composer And a Feminist who must Meet a Secret Agent in The Canadian Rockies",2006,English,NULL,6,PG-13,"47 MySakila Drive",Lethbridge,91400,613124286867,"DONALD MAHON",DONALD.MAHON@sakilacustomer.org,"Mike Hillyer",Mike.Hillyer@sakilastaff.com,2,8483,0.99,"2005-05-29 14:23:58"
782,"2005-05-29 14:38:57",2255,596,"2005-06-02 13:18:57","2006-02-15 21:30:53","JOON NORTHWEST","A Thrilling Panorama of a Technical Writer And a Car who must Discover a Forensic Psychologist in A Shark Tank",2006,English,NULL,3,NC-17,"47 MySakila Drive",Lethbridge,97661,199514580428,"ENRIQUE FORSYTHE",ENRIQUE.FORSYTHE@sakilacustomer.org,"Mike Hillyer",Mike.Hillyer@sakilastaff.com,2,15959,1.99,"2005-05-29 14:38:57"
783,"2005-05-29 14:41:18",3046,53,"2005-06-06 10:39:18","2006-02-15 21:30:53","PEAK FOREVER","A Insightful Reflection of a Boat And a Secret Agent who must Vanquish a Astronaut in An Abandoned Mine Shaft",2006,English,NULL,7,PG,"28 MySQL Boulevard",Woodridge,38594,697760867968,"HEATHER MORRIS",HEATHER.MORRIS@sakilacustomer.org,"Jon Stephens",Jon.Stephens@sakilastaff.com,2,1457,5.99,"2005-05-29 14:41:18"
784,"2005-05-29 14:44:22",2936,352,"2005-06-01 17:28:22","2006-02-15 21:30:53","OTHERS SOUP","A Lacklusture Documentary of a Mad Cow And a Madman who must Sink a Moose in The Gulf of Mexico",2006,English,NULL,7,PG,"47 MySakila Drive",Lethbridge,37636,256546485220,"ALBERT CROUSE",ALBERT.CROUSE@sakilacustomer.org,"Mike Hillyer",Mike.Hillyer@sakilastaff.com,1,9510,2.99,"2005-05-29 14:44:22"
785,"2005-05-29 15:08:41",39,72,"2005-05-30 15:51:41","2006-02-15 21:30:53","AIRPORT POLLOCK","A Epic Tale of a Moose And a Girl who must Confront a Monkey in Ancient India",2006,English,NULL,6,R,"28 MySQL Boulevard",Woodridge,75444,255800440636,"THERESA WATSON",THERESA.WATSON@sakilacustomer.org,"Jon Stephens",Jon.Stephens@sakilastaff.com,2,1940,4.99,"2005-05-29 15:08:41"
786,"2005-05-29 15:17:28",2637,439,"2005-06-07 10:07:28","2006-02-15 21:30:53","MILLION ACE","A Brilliant Documentary of a Womanizer And a Squirrel who must Find a Technical Writer in The Sahara Desert",2006,English,NULL,4,PG-13,"28 MySQL Boulevard",Woodridge,57833,575081026569,"ALEXANDER FENNELL",ALEXANDER.FENNELL@sakilacustomer.org,"Jon Stephens",Jon.Stephens@sakilastaff.com,1,11831,9.99,"2005-05-29 15:17:28"
787,"2005-05-29 16:03:03",3919,27,"2005-06-07 11:07:03","2006-02-15 21:30:53","STREAK RIDGEMONT","A Astounding Character Study of a Hunter And a Waitress who must Sink a Man in New Orleans",2006,English,NULL,7,PG-13,"28 MySQL Boulevard",Woodridge,49521,665356572025,"SHIRLEY ALLEN",SHIRLEY.ALLEN@sakilacustomer.org,"Jon Stephens",Jon.Stephens@sakilastaff.com,2,719,2.99,"2005-05-29 16:03:03"
788,"2005-05-29 16:13:55",763,562,"2005-05-31 16:40:55","2006-02-15 21:30:53","COLOR PHILADELPHIA","A Thoughtful Panorama of a Car And a Crocodile who must Sink a Monkey in The Sahara Desert",2006,English,NULL,6,G,"28 MySQL Boulevard",Woodridge,93655,946114054231,"WALLACE SLONE",WALLACE.SLONE@sakilacustomer.org,"Jon Stephens",Jon.Stephens@sakilastaff.com,2,15048,2.99,"2005-05-29 16:13:55"
789,"2005-05-29 16:17:07",708,553,"2005-06-06 18:15:07","2006-02-15 21:30:53","CLASH FREDDY","A Amazing Yarn of a Composer And a Squirrel who must Escape a Astronaut in Australia",2006,English,NULL,6,G,"28 MySQL Boulevard",Woodridge,11892,698182547686,"MAX PITT",MAX.PITT@sakilacustomer.org,"Jon Stephens",Jon.Stephens@sakilastaff.com,2,14827,4.99,"2005-05-29 16:17:07"
790,"2005-05-29 16:19:29",2858,593,"2005-06-02 17:22:29","2006-02-15 21:30:53","NOON PAPI","A Unbelieveable Character Study of a Mad Scientist And a Astronaut who must Find a Pioneer in A Manhattan Penthouse",2006,English,NULL,5,G,"28 MySQL Boulevard",Woodridge,36693,137809746111,"RENE MCALISTER",RENE.MCALISTER@sakilacustomer.org,"Jon Stephens",Jon.Stephens@sakilastaff.com,1,15873,2.99,"2005-05-29 16:19:29"
