528,"2005-05-28 04:30:05",1655,359,"2005-06-03 10:01:05","2006-02-15 21:30:53","GLEAMING JAWBREAKER","A Amazing Display of a Composer And a Forensic Psychologist who must Discover a Car in The Canadian Rockies",2006,English,NULL,5,NC-17,"28 MySQL Boulevard",Woodridge,91299,296394569728,"WILLIE MARKHAM",WILLIE.MARKHAM@sakilacustomer.org,"Jon Stephens",Jon.Stephens@sakilastaff.com,1,9686,3.99,"2005-05-28 04:30:05"
529,"2005-05-28 04:34:17",2624,469,"2005-05-30 00:35:17","2006-02-15 21:30:53","MIDSUMMER GROUNDHOG","A Fateful Panorama of a Moose And a Dog who must Chase a Crocodile in Ancient Japan",2006,English,NULL,3,G,"28 MySQL Boulevard",Woodridge,95835,622884741180,"WESLEY BULL",WESLEY.BULL@sakilacustomer.org,"Jon Stephens",Jon.Stephens@sakilastaff.com,2,12652,4.99,"2005-05-28 04:34:17"
530,"2005-05-28 05:13:01",3332,312,"2005-06-01 10:21:01","2006-02-15 21:30:53","RIVER OUTLAW","A Thrilling Character Study of a Squirrel And a Lumberjack who must Face a Hunter in A MySQL Convention",2006,English,NULL,4,PG-13,"47 MySakila Drive",Lethbridge,17032,824396883951,"MARK RINEHART",MARK.RINEHART@sakilacustomer.org,"Mike Hillyer",Mike.Hillyer@sakilastaff.com,1,8456,0.99,"2005-05-28 05:13:01"
531,"2005-05-28 05:23:38",1113,589,"2005-05-29 08:00:38","2006-02-15 21:30:53","DOWNHILL ENOUGH","A Emotional Tale of a Pastry Chef And a Forensic Psychologist who must Succumb a Monkey in The Sahara Desert",2006,English,NULL,3,G,"47 MySakila Drive",Lethbridge,22474,154124128457,"TRACY HERRMANN",TRACY.HERRMANN@sakilacustomer.org,"Mike Hillyer",Mike.Hillyer@sakilastaff.com,1,15764,0.99,"2005-05-28 05:23:38"
532,"2005-05-28 05:36:58",2793,120,"2005-06-02 01:50:58","2006-02-15 21:30:53","MYSTIC TRUMAN","A Epic Yarn of a Teacher And a Hunter who must Outgun a Explorer in Soviet Georgia",2006,English,NULL,5,NC-17,"47 MySakila Drive",Lethbridge,76157,765345144779,"SYLVIA ORTIZ",SYLVIA.ORTIZ@sakilacustomer.org,"Mike Hillyer",Mike.Hillyer@sakilastaff.com,2,3223,0.99,"2005-05-28 05:36:58"
533,"2005-05-28 06:14:46",4306,528,"2005-06-01 06:26:46","2006-02-15 21:30:53","VELVET TERMINATOR","A Lacklusture Tale of a Pastry Chef And a Technical Writer who must Confront a Crocodile in An Abandoned Amusement Park",2006,English,NULL,3,R,"47 MySakila Drive",Lethbridge,35202,105882218332,"CLAUDE HERZOG",CLAUDE.HERZOG@sakilacustomer.org,"Mike Hillyer",Mike.Hillyer@sakilastaff.com,1,14207,5.99,"2005-05-28 06:14:46"
534,"2005-05-28 06:15:25",992,184,"2005-06-06 07:51:25","2006-02-15 21:30:53","DEER VIRGINIAN","A Thoughtful Story of a Mad Cow And a Womanizer who must Overcome a Mad Scientist in Soviet Georgia",2006,English,NULL,7,NC-17,"28 MySQL Boulevard",Woodridge,43310,302590383819,"VIVIAN RUIZ",VIVIAN.RUIZ@sakilacustomer.org,"Jon Stephens",Jon.Stephens@sakilastaff.com,2,4998,4.99,"2005-05-28 06:15:25"
535,"2005-05-28 06:16:32",4209,307,"2005-05-31 02:48:32","2006-02-15 21:30:53","TRUMAN CRAZY","A Thrilling Epistle of a Moose And a Boy who must Meet a Database Administrator in A Monastery",2006,English,NULL,7,G,"47 MySakila Drive",Lethbridge,80184,573441801529,"JOSEPH JOY",JOSEPH.JOY@sakilacustomer.org,"Mike Hillyer",Mike.Hillyer@sakilastaff.com,1,8327,4.99,"2005-05-28 06:16:32"
536,"2005-05-28 06:17:33",2962,514,"2005-06-03 10:02:33","2006-02-15 21:30:53","OZ LIAISONS","A Epic Yarn of a Mad Scientist And a Cat who must Confront a Womanizer in A Baloon Factory",2006,English,NULL,4,R,"28 MySQL Boulevard",Woodridge,35156,288910576761,"FRANKLIN TROUTMAN",FRANKLIN.TROUTMAN@sakilacustomer.org,"Jon Stephens",Jon.Stephens@sakilastaff.com,2,13838,4.99,"2005-05-28 06:17:33"
537,"2005-05-28 06:20:55",3095,315,"2005-06-05 11:48:55","2006-02-15 21:30:53","PINOCCHIO SIMON","A Action-Packed Reflection of a Mad Scientist And a A Shark who must Find a Feminist in California",2006,English,NULL,4,PG,"28 MySQL Boulevard",Woodridge,62472,508800331065,"KENNETH GOODEN",KENNETH.GOODEN@sakilacustomer.org,"Jon Stephens",Jon.Stephens@sakilastaff.com,1,8537,8.99,"2005-05-28 06:20:55"
538,"2005-05-28 06:21:05",2262,110,"2005-06-02 01:22:05","2006-02-15 21:30:53","JUGGLER HARDLY","A Epic Story of a Mad Cow And a Astronaut who must Challenge a Car in California",2006,English,NULL,4,PG-13,"47 MySakila Drive",Lethbridge,61069,379804592943,"TIFFANY JORDAN",TIFFANY.JORDAN@sakilacustomer.org,"Mike Hillyer",Mike.Hillyer@sakilastaff.com,2,2960,1.99,"2005-05-28 06:21:05"
539,"2005-05-28 06:26:16",3427,161,"2005-05-30 02:02:16","2006-02-15 21:30:53","RUNAWAY TENENBAUMS","A Thoughtful Documentary of a Boat And a Man who must Meet a Boat in An Abandoned Fun House",2006,English,NULL,6,NC-17,"28 MySQL Boulevard",Woodridge,44660,177167004331,"GERALDINE PERKINS",GERALDINE.PERKINS@sakilacustomer.org,"Jon Stephens",Jon.Stephens@sakilastaff.com,2,4375,0.99,"2005-05-28 06:26:16"
540,"2005-05-28 06:40:25",3321,119,"2005-06-06 00:47:25","2006-02-15 21:30:53","RIDGEMONT SUBMARINE","A Unbelieveable Drama of a Waitress And a Composer who must Sink a Mad Cow in Ancient Japan",2006,English,NULL,3,PG-13,"28 MySQL Boulevard",Woodridge,96065,787654415858,"SHERRY MARSHALL",SHERRY.MARSHALL@sakilacustomer.org,"Jon Stephens",Jon.Stephens@sakilastaff.com,2,3190,6.99,"2005-05-28 06:40:25"
541,"2005-05-28 06:41:58",1662,535,"2005-06-02 09:12:58","2006-02-15 21:30:53","GO PURPLE","A Fast-Paced Display of a Car And a Database Administrator who must Battle a Woman in A Baloon",2006,English,NULL,3,R,"47 MySakila Drive",Lethbridge,49250,8912935608,"JAVIER ELROD",JAVIER.ELROD@sakilacustomer.org,"Mike Hillyer",Mike.Hillyer@sakilastaff.com,2,14397,2.99,"2005-05-28 06:41:58"
542,"2005-05-28 06:42:13",4444,261,"2005-06-03 09:05:13","2006-02-15 21:30:53","WHALE BIKINI","A Intrepid Story of a Pastry Chef And a Database Administrator who must Kill a Feminist in A MySQL Convention",2006,English,NULL,4,PG-13,"47 MySakila Drive",Lethbridge,30065,265153400632,"DEANNA BYRD",DEANNA.BYRD@sakilacustomer.org,"Mike Hillyer",Mike.Hillyer@sakilastaff.com,2,7046,6.99,"2005-05-28 06:42:13"
543,"2005-05-28 06:43:34",530,493,"2005-06-06 07:16:34","2006-02-15 21:30:53","CANDIDATE PERDITION","A Brilliant Epistle of a Composer And a Database Administrator who must Vanquish a Mad Scientist in The First Manned Space Station",2006,English,NULL,4,R,"28 MySQL Boulevard",Woodridge,26101,854259976812,"BRENT HARKINS",BRENT.HARKINS@sakilacustomer.org,"Jon Stephens",Jon.Stephens@sakilastaff.com,1,13276,7.99,"2005-05-28 06:43:34"
544,"2005-05-28 07:03:00",2964,311,"2005-06-06 06:23:00","2006-02-15 21:30:53","PACIFIC AMISTAD","A Thrilling Yarn of a Dog And a Moose who must Kill a Pastry Chef in A Manhattan Penthouse",2006,English,NULL,3,G,"47 MySakila Drive",Lethbridge,94878,688485191923,"PAUL TROUT",PAUL.TROUT@sakilacustomer.org,"Mike Hillyer",Mike.Hillyer@sakilastaff.com,2,8433,6.99,"2005-05-28 07:03:00"
545,"2005-05-28 07:10:20",1086,54,"2005-06-04 01:47:20","2006-02-15 21:30:53","DOOM DANCING","A Astounding Panorama of a Car And a Mad Scientist who must Battle a Lumberjack in A MySQL Convention",2006,English,NULL,4,R,"28 MySQL Boulevard",Woodridge,48980,920811325222,"TERESA ROGERS",TERESA.ROGERS@sakilacustomer.org,"Jon Stephens",Jon.Stephens@sakilastaff.com,2,1486,3.99,"2005-05-28 07:10:20"
546,"2005-05-28 07:16:25",487,20,"2005-06-01 08:36:25","2006-02-15 21:30:53","BUTTERFLY CHOCOLAT","A Fateful Story of a Girl And a Composer who must Conquer a Husband in A Shark Tank",2006,English,NULL,3,G,"47 MySakila Drive",Lethbridge,21954,144453869132,"SHARON ROBINSON",SHARON.ROBINSON@sakilacustomer.org,"Mike Hillyer",Mike.Hillyer@sakilastaff.com,2,516,1.99,"2005-05-28 07:16:25"
547,"2005-05-28 07:24:28",2065,506,"2005-06-06 01:31:28","2006-02-15 21:30:53","IDAHO LOVE","A Fast-Paced Drama of a Student And a Crocodile who must Meet a Database Administrator in The Outback",2006,English,NULL,3,PG-13,"47 MySakila Drive",Lethbridge,44816,131370665218,"LESLIE SEWARD",LESLIE.SEWARD@sakilacustomer.org,"Mike Hillyer",Mike.Hillyer@sakilastaff.com,1,13629,8.99,"2005-05-28 07:24:28"
548,"2005-05-28 07:34:56",3704,450,"2005-06-05 03:14:56","2006-02-15 21:30:53","SLUMS DUCK","A Amazing Character Study of a Teacher And a Database Administrator who must Defeat a Waitress in A Jet Boat",2006,English,NULL,5,PG,"28 MySQL Boulevard",Woodridge,23636,834061016202,"JAY ROBB",JAY.ROBB@sakilacustomer.org,"Jon Stephens",Jon.Stephens@sakilastaff.com,2,12134,3.99,"2005-05-28 07:34:56"
549,"2005-05-28 07:35:37",1818,159,"2005-06-02 09:08:37","2006-02-15 21:30:53","HANDICAP BOONDOCK","A Beautiful Display of a Pioneer And a Squirrel who must Vanquish a Sumo Wrestler in Soviet Georgia",2006,English,NULL,4,R,"47 MySakila Drive",Lethbridge,81037,931059836497,"JILL HAWKINS",JILL.HAWKINS@sakilacustomer.org,"Mike Hillyer",Mike.Hillyer@sakilastaff.com,2,4325,1.99,"2005-05-28 07:35:37"
550,"2005-05-28 07:39:16",3632,432,"2005-06-06 12:20:16","2006-02-15 21:30:53","SHRUNK DIVINE","A Fateful Character Study of a Waitress And a Technical Writer who must Battle a Hunter in A Baloon",2006,English,NULL,6,R,"47 MySakila Drive",Lethbridge,63104,617567598243,"EDWIN BURK",EDWIN.BURK@sakilacustomer.org,"Mike Hillyer",Mike.Hillyer@sakilastaff.com,1,11644,5.99,"2005-05-28 07:39:16"
551,"2005-05-28 07:44:18",3119,315,"2005-06-02 12:55:18","2006-02-15 21:30:53","PLUTO OLEANDER","A Action-Packed Reflection of a Car And a Moose who must Outgun a Car in A Shark Tank",2006,English,NULL,5,R,"47 MySakila Drive",Lethbridge,62472,508800331065,"KENNETH GOODEN",KENNETH.GOODEN@sakilacustomer.org,"Mike Hillyer",Mike.Hillyer@sakilastaff.com,1,8538,4.99,"2005-05-28 07:44:18"
552,"2005-05-28 07:53:38",23,106,"2005-06-04 12:45:38","2006-02-15 21:30:53","AFRICAN EGG","A Fast-Paced Documentary of a Pastry Chef And a Dentist who must Pursue a Forensic Psychologist in The Gulf of Mexico",2006,English,NULL,6,G,"28 MySQL Boulevard",Woodridge,78311,547003310357,"CONNIE WALLACE",CONNIE.WALLACE@sakilacustomer.org,"Jon Stephens",Jon.Stephens@sakilastaff.com,2,2850,3.99,"2005-05-28 07:53:38"
553,"2005-05-28 08:14:44",1349,176,"2005-06-02 03:01:44","2006-02-15 21:30:53","EYES DRIVING","A Thrilling Story of a Cat And a Waitress who must Fight a Explorer in The Outback",2006,English,NULL,4,PG-13,"47 MySakila Drive",Lethbridge,89668,506134035434,"JUNE CARROLL",JUNE.CARROLL@sakilacustomer.org,"Mike Hillyer",Mike.Hillyer@sakilastaff.com,1,4765,3.99,"2005-05-28 08:14:44"
554,"2005-05-28 08:23:16",1951,376,"2005-05-31 03:29:16","2006-02-15 21:30:53","HOLY TADPOLE","A Action-Packed Display of a Feminist And a Pioneer who must Pursue a Dog in A Baloon Factory",2006,English,NULL,6,R,"28 MySQL Boulevard",Woodridge,26385,96846695220,"RANDY GAITHER",RANDY.GAITHER@sakilacustomer.org,"Jon Stephens",Jon.Stephens@sakilastaff.com,1,10175,0.99,"2005-05-28 08:23:16"
555,"2005-05-28 08:31:14",4397,55,"2005-05-30 07:34:14","2006-02-15 21:30:53","WASH HEAVENLY","A Awe-Inspiring Reflection of a Cat And a Pioneer who must Escape a Hunter in Ancient China",2006,English,NULL,7,R,"47 MySakila Drive",Lethbridge,57807,499352017190,"DORIS REED",DORIS.REED@sakilacustomer.org,"Mike Hillyer",Mike.Hillyer@sakilastaff.com,1,1513,4.99,"2005-05-28 08:31:14"
556,"2005-05-28 08:31:36",1814,22,"2005-06-06 07:29:36","2006-02-15 21:30:53","HAMLET WISDOM","A Touching Reflection of a Man And a Man who must Sink a Robot in The Outback",2006,English,NULL,7,R,"47 MySakila Drive",Lethbridge,37551,161968374323,"LAURA RODRIGUEZ",LAURA.RODRIGUEZ@sakilacustomer.org,"Mike Hillyer",Mike.Hillyer@sakilastaff.com,1,580,4.99,"2005-05-28 08:31:36"
557,"2005-05-28 08:36:22",158,444,"2005-06-03 10:42:22","2006-02-15 21:30:53","ARABIA DOGMA","A Touching Epistle of a Madman And a Mad Cow who must Defeat a Student in Nigeria",2006,English,NULL,6,NC-17,"28 MySQL Boulevard",Woodridge,88306,237368926031,"MARCUS HIDALGO",MARCUS.HIDALGO@sakilacustomer.org,"Jon Stephens",Jon.Stephens@sakilastaff.com,1,11970,0.99,"2005-05-28 08:36:22"
558,"2005-05-28 08:38:43",4163,442,"2005-06-06 13:52:43","2006-02-15 21:30:53","TRAINSPOTTING STRANGERS","A Fast-Paced Drama of a Pioneer And a Mad Cow who must Challenge a Madman in Ancient Japan",2006,English,NULL,7,PG-13,"47 MySakila Drive",Lethbridge,48570,240776414296,"LEROY BUSTAMANTE",LEROY.BUSTAMANTE@sakilacustomer.org,"Mike Hillyer",Mike.Hillyer@sakilastaff.com,2,11916,6.99,"2005-05-28 08:38:43"
559,"2005-05-28 08:39:02",1227,572,"2005-06-05 08:38:02","2006-02-15 21:30:53","EDGE KISSING","A Beautiful Yarn of a Composer And a Mad Cow who must Redeem a Mad Scientist in A Jet Boat",2006,English,NULL,5,NC-17,"47 MySakila Drive",Lethbridge,86587,867287719310,"SIDNEY BURLESON",SIDNEY.BURLESON@sakilacustomer.org,"Mike Hillyer",Mike.Hillyer@sakilastaff.com,2,15312,7.99,"2005-05-28 08:39:02"
560,"2005-05-28 08:53:02",644,463,"2005-06-04 12:27:02","2006-02-15 21:30:53","CHEAPER CLYDE","A Emotional Character Study of a Pioneer And a Girl who must Discover a Dog in Ancient Japan",2006,English,NULL,6,G,"47 MySakila Drive",Lethbridge,84461,164414772677,"DARRELL POWER",DARRELL.POWER@sakilacustomer.org,"Mike Hillyer",Mike.Hillyer@sakilastaff.com,1,12501,1.99,"2005-05-28 08:53:02"
561,"2005-05-28 08:54:06",928,77,"2005-06-05 05:54:06","2006-02-15 21:30:53","DANCING FEVER","A Stunning Story of a Explorer And a Forensic Psychologist who must Face a Crocodile in A Shark Tank",2006,English,NULL,6,G,"47 MySakila Drive",Lethbridge,9223,918711376618,"JANE BENNETT",JANE.BENNETT@sakilacustomer.org,"Mike Hillyer",Mike.Hillyer@sakilastaff.com,2,2087,2.99,"2005-05-28 08:54:06"
562,"2005-05-28 09:01:21",3390,102,"2005-06-02 05:26:21","2006-02-15 21:30:53","ROOTS REMEMBER","A Brilliant Drama of a Mad Cow And a Hunter who must Escape a Hunter in Berlin",2006,English,NULL,4,PG-13,"28 MySQL Boulevard",Woodridge,49708,709935135487,"CRYSTAL FORD",CRYSTAL.FORD@sakilacustomer.org,"Jon Stephens",Jon.Stephens@sakilastaff.com,2,2738,1.99,"2005-05-28 09:01:21"
563,"2005-05-28 09:10:49",53,324,"2005-06-06 11:32:49","2006-02-15 21:30:53","ALAMO VIDEOTAPE","A Boring Epistle of a Butler And a Cat who must Fight a Pastry Chef in A MySQL Convention",2006,English,NULL,6,G,"47 MySakila Drive",Lethbridge,78543,168884817145,"GARY COY",GARY.COY@sakilacustomer.org,"Mike Hillyer",Mike.Hillyer@sakilastaff.com,2,8754,3.99,"2005-05-28 09:10:49"
564,"2005-05-28 09:12:09",2973,282,"2005-05-29 05:07:09","2006-02-15 21:30:53","PACKER MADIGAN","A Epic Display of a Sumo Wrestler And a Forensic Psychologist who must Build a Woman in An Abandoned Amusement Park",2006,English,NULL,3,PG-13,"28 MySQL Boulevard",Woodridge,8160,62781725285,"JENNY CASTRO",JENNY.CASTRO@sakilacustomer.org,"Jon Stephens",Jon.Stephens@sakilastaff.com,2,7627,0.99,"2005-05-28 09:12:09"
565,"2005-05-28 09:26:31",1494,288,"2005-06-01 07:28:31","2006-02-15 21:30:53","FOOL MOCKINGBIRD","A Lacklusture Tale of a Crocodile And a Composer who must Defeat a Madman in A U-Boat",2006,English,NULL,3,PG,"47 MySakila Drive",Lethbridge,33768,957128697225,"BOBBIE CRAIG",BOBBIE.CRAIG@sakilacustomer.org,"Mike Hillyer",Mike.Hillyer@sakilastaff.com,2,7793,5.99,"2005-05-28 09:26:31"
566,"2005-05-28 09:51:39",4330,253,"2005-06-05 09:35:39","2006-02-15 21:30:53","VIRGIN DAISY","A Awe-Inspiring Documentary of a Robot And a Mad Scientist who must Reach a Database Administrator in A Shark Tank",2006,English,NULL,6,PG-13,"28 MySQL Boulevard",Woodridge,32474,134673576619,"TERRY CARLSON",TERRY.CARLSON@sakilacustomer.org,"Jon Stephens",Jon.Stephens@sakilastaff.com,1,6810,6.99,"2005-05-28 09:51:39"
567,"2005-05-28 09:56:20",3308,184,"2005-06-01 06:41:20","2006-02-15 21:30:53","REUNION WITCHES","A Unbelieveable Documentary of a Database Administrator And a Frisbee who must Redeem a Mad Scientist in A Baloon Factory",2006,English,NULL,3,R,"47 MySakila Drive",Lethbridge,43310,302590383819,"VIVIAN RUIZ",VIVIAN.RUIZ@sakilacustomer.org,"Mike Hillyer",Mike.Hillyer@sakilastaff.com,1,4999,1.99,"2005-05-28 09:56:20"
568,"2005-05-28 09:57:36",2232,155,"2005-05-31 15:44:36","2006-02-15 21:30:53","JERICHO MULAN","A Amazing Yarn of a Hunter And a Butler who must Defeat a Boy in A Jet Boat",2006,English,NULL,3,NC-17,"47 MySakila Drive",Lethbridge,41778,904253967161,"GAIL KNIGHT",GAIL.KNIGHT@sakilacustomer.org,"Mike Hillyer",Mike.Hillyer@sakilastaff.com,1,4211,2.99,"2005-05-28 09:57:36"
569,"2005-05-28 10:12:41",4534,56,"2005-06-03 10:08:41","2006-02-15 21:30:53","WORKING MICROCOSMOS","A Stunning Epistle of a Dentist And a Dog who must Kill a Madman in Ancient China",2006,English,NULL,4,R,"28 MySQL Boulevard",Woodridge,39072,347487831378,"GLORIA COOK",GLORIA.COOK@sakilacustomer.org,"Jon Stephens",Jon.Stephens@sakilastaff.com,1,1538,6.99,"2005-05-28 10:12:41"
570,"2005-05-28 10:15:04",1122,21,"2005-05-30 08:32:04","2006-02-15 21:30:53","DRACULA CRYSTAL","A Thrilling Reflection of a Feminist And a Cat who must Find a Frisbee in An Abandoned Fun House",2006,English,NULL,7,G,"47 MySakila Drive",Lethbridge,34418,892775750063,"MICHELLE CLARK",MICHELLE.CLARK@sakilacustomer.org,"Mike Hillyer",Mike.Hillyer@sakilastaff.com,1,546,0.99,"2005-05-28 10:15:04"
571,"2005-05-28 10:17:41",4250,516,"2005-06-05 07:56:41","2006-02-15 21:30:53","UNFORGIVEN ZOOLANDER","A Taut Epistle of a Monkey And a Sumo Wrestler who must Vanquish a A Shark in A Baloon Factory",2006,English,NULL,7,PG,"47 MySakila Drive",Lethbridge,32347,448876499197,"ELMER NOE",ELMER.NOE@sakilacustomer.org,"Mike Hillyer",Mike.Hillyer@sakilastaff.com,1,13889,1.99,"2005-05-28 10:17:41"
572,"2005-05-28 10:30:13",1899,337,"2005-06-02 05:04:13","2006-02-15 21:30:53","HELLFIGHTERS SIERRA","A Taut Reflection of a A Shark And a Dentist who must Battle a Boat in Soviet Georgia",2006,English,NULL,3,PG,"47 MySakila Drive",Lethbridge,52368,647899404952,"JERRY JORDON",JERRY.JORDON@sakilacustomer.org,"Mike Hillyer",Mike.Hillyer@sakilastaff.com,1,9098,4.99,"2005-05-28 10:30:13"
573,"2005-05-28 10:35:23",4020,1,"2005-06-03 06:32:23","2006-02-15 21:30:53","TALENTED HOMICIDE","A Lacklusture Panorama of a Dentist And a Forensic Psychologist who must Outrace a Pioneer in A U-Boat",2006,English,NULL,6,PG,"28 MySQL Boulevard",Woodridge,35200,28303384290,"MARY SMITH",MARY.SMITH@sakilacustomer.org,"Jon Stephens",Jon.Stephens@sakilastaff.com,1,2,0.99,"2005-05-28 10:35:23"
574,"2005-05-28 10:44:28",3883,76,"2005-06-04 11:42:28","2006-02-15 21:30:53","STORM HAPPINESS","A Insightful Drama of a Feminist And a A Shark who must Vanquish a Boat in A Shark Tank",2006,English,NULL,6,NC-17,"47 MySakila Drive",Lethbridge,98889,896314772871,"IRENE PRICE",IRENE.PRICE@sakilacustomer.org,"Mike Hillyer",Mike.Hillyer@sakilastaff.com,2,2062,1.99,"2005-05-28 10:44:28"
575,"2005-05-28 10:56:09",4451,142,"2005-06-05 15:39:09","2006-02-15 21:30:53","WIFE TURN","A Awe-Inspiring Epistle of a Teacher And a Feminist who must Confront a Pioneer in Ancient Japan",2006,English,NULL,3,NC-17,"47 MySakila Drive",Lethbridge,60562,581174211853,"APRIL BURNS",APRIL.BURNS@sakilacustomer.org,"Mike Hillyer",Mike.Hillyer@sakilastaff.com,1,3833,9.99,"2005-05-28 10:56:09"
576,"2005-05-28 10:56:10",1866,588,"2005-06-04 13:15:10","2006-02-15 21:30:53","HAWK CHILL","A Action-Packed Drama of a Mad Scientist And a Composer who must Outgun a Car in Australia",2006,English,NULL,5,PG-13,"47 MySakila Drive",Lethbridge,17381,338758048786,"MARION OCAMPO",MARION.OCAMPO@sakilacustomer.org,"Mike Hillyer",Mike.Hillyer@sakilastaff.com,1,15735,2.99,"2005-05-28 10:56:10"
577,"2005-05-28 11:09:14",375,6,"2005-06-01 13:27:14","2006-02-15 21:30:53","BLUES INSTINCT","A Insightful Documentary of a Boat And a Composer who must Meet a Forensic Psychologist in An Abandoned Fun House",2006,English,NULL,5,G,"47 MySakila Drive",Lethbridge,18743,860452626434,"JENNIFER DAVIS",JENNIFER.DAVIS@sakilacustomer.org,"Mike Hillyer",Mike.Hillyer@sakilastaff.com,1,147,2.99,"2005-05-28 11:09:14"
578,"2005-05-28 11:15:48",2938,173,"2005-06-02 09:59:48","2006-02-15 21:30:53","OTHERS SOUP","A Lacklusture Documentary of a Mad Cow And a Madman who must Sink a Moose in The Gulf of Mexico",2006,English,NULL,7,PG,"28 MySQL Boulevard",Woodridge,6802,493008546874,"AUDREY RAY",AUDREY.RAY@sakilacustomer.org,"Jon Stephens",Jon.Stephens@sakilastaff.com,2,4689,2.99,"2005-05-28 11:15:48"
579,"2005-05-28 11:19:23",3481,181,"2005-06-02 13:51:23","2006-02-15 21:30:53","SATISFACTION CONFIDENTIAL","A Lacklusture Yarn of a Dentist And a Butler who must Meet a Secret Agent in Ancient China",2006,English,NULL,3,G,"47 MySakila Drive",Lethbridge,67497,72136330362,"ANA BRADLEY",ANA.BRADLEY@sakilacustomer.org,"Mike Hillyer",Mike.Hillyer@sakilastaff.com,2,4914,6.99,"2005-05-28 11:19:23"
580,"2005-05-28 11:19:53",3515,17,"2005-06-01 10:44:53","2006-02-15 21:30:53","SCISSORHANDS SLUMS","A Awe-Inspiring Drama of a Girl And a Technical Writer who must Meet a Feminist in The Canadian Rockies",2006,English,NULL,5,G,"28 MySQL Boulevard",Woodridge,81766,407752414682,"DONNA THOMPSON",DONNA.THOMPSON@sakilacustomer.org,"Jon Stephens",Jon.Stephens@sakilastaff.com,1,448,2.99,"2005-05-28 11:19:53"
581,"2005-05-28 11:20:29",1380,186,"2005-06-04 12:37:29","2006-02-15 21:30:53","FANTASY TROOPERS","A Touching Saga of a Teacher And a Monkey who must Overcome a Secret Agent in A MySQL Convention",2006,English,NULL,6,PG-13,"47 MySakila Drive",Lethbridge,74750,760171523969,"HOLLY FOX",HOLLY.FOX@sakilacustomer.org,"Mike Hillyer",Mike.Hillyer@sakilastaff.com,1,5043,1.99,"2005-05-28 11:20:29"
582,"2005-05-28 11:33:46",4579,198,"2005-05-29 08:33:46","2006-02-15 21:30:53","ZORRO ARK","A Intrepid Panorama of a Mad Scientist And a Boy who must Redeem a Boy in A Monastery",2006,English,NULL,3,NC-17,"28 MySQL Boulevard",Woodridge,1545,768481779568,"ELSIE KELLEY",ELSIE.KELLEY@sakilacustomer.org,"Jon Stephens",Jon.Stephens@sakilastaff.com,1,5357,4.99,"2005-05-28 11:33:46"
583,"2005-05-28 11:48:55",2679,386,"2005-06-04 07:09:55","2006-02-15 21:30:53","MODEL FISH","A Beautiful Panorama of a Boat And a Crocodile who must Outrace a Dog in Australia",2006,English,NULL,4,NC-17,"28 MySQL Boulevard",Woodridge,33535,619966287415,"TODD TAN",TODD.TAN@sakilacustomer.org,"Jon Stephens",Jon.Stephens@sakilastaff.com,1,10444,7.99,"2005-05-28 11:48:55"
584,"2005-05-28 11:49:00",1833,69,"2005-06-01 11:54:00","2006-02-15 21:30:53","HANOVER GALAXY","A Stunning Reflection of a Girl And a Secret Agent who must Succumb a Boy in A MySQL Convention",2006,English,NULL,5,NC-17,"28 MySQL Boulevard",Woodridge,59025,107137400143,"JUDY GRAY",JUDY.GRAY@sakilacustomer.org,"Jon Stephens",Jon.Stephens@sakilastaff.com,2,1867,4.99,"2005-05-28 11:49:00"
585,"2005-05-28 11:50:45",3544,490,"2005-06-03 15:35:45","2006-02-15 21:30:53","SEATTLE EXPECATIONS","A Insightful Reflection of a Crocodile And a Sumo Wrestler who must Meet a Technical Writer in The Sahara Desert",2006,English,NULL,4,PG-13,"47 MySakila Drive",Lethbridge,19489,17305839123,"SAM MCDUFFIE",SAM.MCDUFFIE@sakilacustomer.org,"Mike Hillyer",Mike.Hillyer@sakilastaff.com,2,13209,6.99,"2005-05-28 11:50:45"
586,"2005-05-28 12:03:00",898,77,"2005-05-29 13:16:00","2006-02-15 21:30:53","CURTAIN VIDEOTAPE","A Boring Reflection of a Dentist And a Mad Cow who must Chase a Secret Agent in A Shark Tank",2006,English,NULL,7,PG-13,"47 MySakila Drive",Lethbridge,9223,918711376618,"JANE BENNETT",JANE.BENNETT@sakilacustomer.org,"Mike Hillyer",Mike.Hillyer@sakilastaff.com,1,2088,0.99,"2005-05-28 12:03:00"
587,"2005-05-28 12:05:33",1413,64,"2005-05-30 13:45:33","2006-02-15 21:30:53","FEUD FROGMEN","A Brilliant Reflection of a Database Administrator And a Mad Cow who must Chase a Woman in The Canadian Rockies",2006,English,NULL,6,R,"28 MySQL Boulevard",Woodridge,70385,333489324603,"JUDITH COX",JUDITH.COX@sakilacustomer.org,"Jon Stephens",Jon.Stephens@sakilastaff.com,1,1735,0.99,"2005-05-28 12:05:33"
588,"2005-05-28 12:08:37",95,89,"2005-05-29 16:25:37","2006-02-15 21:30:53","AMADEUS HOLY","A Emotional Display of a Pioneer And a Technical Writer who must Battle a Man in A Baloon",2006,English,NULL,6,PG,"47 MySakila Drive",Lethbridge,75543,846225459260,"JULIA FLORES",JULIA.FLORES@sakilacustomer.org,"Mike Hillyer",Mike.Hillyer@sakilastaff.com,2,2410,0.99,"2005-05-28 12:08:37"
589,"2005-05-28 12:27:50",4231,308,"2005-06-03 07:15:50","2006-02-15 21:30:53","UNBREAKABLE KARATE","A Amazing Character Study of a Robot And a Student who must Chase a Robot in Australia",2006,English,NULL,3,G,"47 MySakila Drive",Lethbridge,9668,983259819766,"THOMAS GRIGSBY",THOMAS.GRIGSBY@sakilacustomer.org,"Mike Hillyer",Mike.Hillyer@sakilastaff.com,2,8356,3.99,"2005-05-28 12:27:50"
590,"2005-05-28 13:06:50",473,462,"2005-06-02 09:18:50","2006-02-15 21:30:53","BUGSY SONG","A Awe-Inspiring Character Study of a Secret Agent And a Boat who must Find a Squirrel in The First Manned Space Station",2006,English,NULL,4,G,"28 MySQL Boulevard",Woodridge,22173,209342540247,"WARREN SHERROD",WARREN.SHERROD@sakilacustomer.org,"Jon Stephens",Jon.Stephens@sakilastaff.com,2,12469,3.99,"2005-05-28 13:06:50"
591,"2005-05-28 13:11:04",377,19,"2005-05-29 17:20:04","2006-02-15 21:30:53","BLUES INSTINCT","A Insightful Documentary of a Boat And a Composer who must Meet a Forensic Psychologist in An Abandoned Fun House",2006,English,NULL,5,G,"28 MySQL Boulevard",Woodridge,72192,272572357893,"RUTH MARTINEZ",RUTH.MARTINEZ@sakilacustomer.org,"Jon Stephens",Jon.Stephens@sakilastaff.com,2,494,2.99,"2005-05-28 13:11:04"
592,"2005-05-28 13:21:08",638,244,"2005-05-29 16:55:08","2006-02-15 21:30:53","CHASING FIGHT","A Astounding Saga of a Technical Writer And a Butler who must Battle a Butler in A Shark Tank",2006,English,NULL,7,PG,"47 MySakila Drive",Lethbridge,27722,569868543137,"VIOLA HANSON",VIOLA.HANSON@sakilacustomer.org,"Mike Hillyer",Mike.Hillyer@sakilastaff.com,2,6590,4.99,"2005-05-28 13:21:08"
